feature,weight,feature_desc,odds_ratio,model,cutoff
71509,0.002434148818416134,"Osteoarthrosis, generalized, multiple sites",1.0024371137638692,lr,180
Z8542,0.0023929479925751547,Personal history of malignant neoplasm of other parts of uterus,1.0023958133777395,lr,180
Z7901,0.002384602015946056,Long term (current) use of anticoagulants,1.002387447440619,lr,180
8024,0.0022701103400498907,Closed fracture of malar and maxillary bones,1.002272688991433,lr,180
V151,0.00226866002491662,"Personal history of surgery to heart and great vessels, presenting hazards to health",1.0022712353812386,lr,180
V558,0.002268524882755815,Attention to other specified artificial opening,1.0022710999321474,lr,180
78559,0.0022398044647963045,Other shock without mention of trauma,1.0022423147006125,lr,180
E8786,0.0022197742464778736,"Removal of other organ (partial) (total) causing abnormal patient reaction, or later complication, without mention of misadventure at time of operation",1.0022222397692944,lr,180
2713,0.0022182991721568326,Intestinal disaccharidase deficiencies and disaccharide malabsorption,1.002220761418095,lr,180
36210,0.002152230681027229,"Background retinopathy, unspecified",1.0021545483919307,lr,180
78842,0.0021245153487425865,Polyuria,1.002126773730515,lr,180
2900,0.0020310793412868125,"Senile dementia, uncomplicated",1.0020331433801044,lr,180
587,0.001994476341355161,"Renal sclerosis, unspecified",1.0019964666322694,lr,180
73390,0.001962013275287342,"Disorder of bone and cartilage, unspecified",1.001963939282745,lr,180
33818,0.001938633584985907,Other acute postoperative pain,1.0019405139499908,lr,180
3543,0.0019000028533161164,Lesion of radial nerve,1.0019018090024525,lr,180
72679,0.0018979796166535747,Other enthesopathy of ankle and tarsus,1.0018997819200308,lr,180
59969,0.0018916831982802504,"Urinary obstruction, not elsewhere classified",1.0018934735596958,lr,180
99791,0.0018765915869803729,"Complications affecting other specified body systems, not elsewhere classified, hypertension",1.0018783534869224,lr,180
81401,0.001820802198854548,Closed fracture of navicular [scaphoid] bone of wrist,1.001822460865727,lr,180
75312,0.001762966494817678,"Polycystic kidney, unspecified type",1.0017645214338828,lr,180
7812,0.001735782554462294,Abnormality of gait,1.001737289897014,lr,180
2148,0.001724022429754052,Lipoma of other specified sites,1.00172550941083,lr,180
2867,0.0016454153350564066,Acquired coagulation factor deficiency,1.0016467697736382,lr,180
9974,0.0016294136669520714,Digestive system complications,1.0016307418827075,lr,180
44031,0.0016021903004794055,Atherosclerosis of autologous vein bypass graft of the extremities,1.0016034744931077,lr,180
0549,0.0016007895532196932,Herpes simplex without mention of complication,1.001602071500768,lr,180
60001,0.0015518398017673226,Hypertrophy (benign) of prostate with urinary obstruction and other lower urinary tract symptoms (LUTS),1.0015530445282528,lr,180
V1047,0.0014896978679309041,Personal history of malignant neoplasm of testis,1.0014908080189946,lr,180
0389,0.0014424102180162132,Unspecified septicemia,1.0014434509919823,lr,180
V5332,0.0012693864404912847,Fitting and adjustment of automatic implantable cardiac defibrillator,1.0012701924524698,lr,180
4519,0.0012589351678129574,Phlebitis and thrombophlebitis of unspecified site,1.0012597279593474,lr,180
57149,0.0012523815996770685,Other chronic hepatitis,1.001253166157,lr,180
8242,0.0011456678876955156,"Fracture of lateral malleolus, closed",1.0011463244158472,lr,180
4959,0.0009341303181534021,Unspecified allergic alveolitis and pneumonitis,1.0009345667537644,lr,180
55091,0.0008994389106252704,"Inguinal hernia, without mention of obstruction or gangrene, unilateral or unspecified, recurrent",1.0008998435271024,lr,180
7336,0.0008794619192137228,Tietze's disease,1.0008798487592427,lr,180
4210,0.0008627745251994324,Acute and subacute bacterial endocarditis,1.0008631468222018,lr,180
V072,0.0007110872547294979,Need for prophylactic immunotherapy,1.0007113401372083,lr,180
59970,0.0007036422223490258,"Hematuria, unspecified",1.0007038898366114,lr,180
9631,0.0006963531441854069,Poisoning by antineoplastic and immunosuppressive drugs,1.0006965956543237,lr,180
N281,0.0006722152625606015,"Cyst of kidney, acquired",1.0006724412498746,lr,180
5699,0.0006181817966937323,Unspecified disorder of intestine,1.0006183729104396,lr,180
0709,0.0005281402422221166,Unspecified viral hepatitis without mention of hepatic coma,1.0005282797328356,lr,180
734,0.000505368831051812,Flat foot,1.000505496551394,lr,180
E8495,0.00036048198599440077,Street and highway accidents,1.0003605469674335,lr,180
25208,0.000297892552149655,Other hyperparathyroidism,1.0002979369265421,lr,180
V8524,0.00029151315696606626,"Body Mass Index 28.0-28.9, adult",1.0002915556510554,lr,180
V1584,0.0002025846185264142,Personal history of contact with and (suspected) exposure to asbestos,1.000202605140176,lr,180
V1272,0.00015957633617834,Personal history of colonic polyps,1.0001595890691592,lr,180
4474,7.477629308329897e-05,Celiac artery compression syndrome,1.0000747790889,lr,180
53500,3.810964222940057e-05,"Acute gastritis, without mention of hemorrhage",1.000038110368411,lr,180
2144,3.706984845861331e-05,Lipoma of spermatic cord,1.000037070535554,lr,180
I2720,0.0,"Pulmonary hypertension, unspecified",1.0,lr,180
1579,0.0,"Malignant neoplasm of pancreas, part unspecified",1.0,lr,180
1570,0.0,Malignant neoplasm of head of pancreas,1.0,lr,180
M48061,0.0,"Spinal stenosis, lumbar region without neurogenic claudication",1.0,lr,180
I378,-5.170382829145821e-05,Other nonrheumatic pulmonary valve disorders,0.9999482975083285,lr,180
8026,-7.34959726641805e-05,Closed fracture of orbital floor (blow-out),0.9999265067280987,lr,180
2518,-0.00010859862723065807,Other specified disorders of pancreatic internal secretion,0.9998914072693869,lr,180
E9429,-0.00014493890145593304,Other and unspecified agents primarily affecting the cardiovascular system causing adverse effects in therapeutic use,0.9998550716016792,lr,180
9975,-0.0002030831437822392,"Urinary complications, not elsewhere classified",0.9997969374762036,lr,180
E9444,-0.00024719453324831487,Other diuretics causing adverse effects in therapeutic use,0.999752836016803,lr,180
C9310,-0.0002753536846312324,Chronic myelomonocytic leukemia not having achieved remission,0.9997246842217153,lr,180
3551,-0.000307352438191773,Meralgia paresthetica,0.9996926947897302,lr,180
Z8719,-0.00032384493297530226,Personal history of other diseases of the digestive system,0.9996762074991349,lr,180
72672,-0.0003655815602123141,Tibialis tendinitis,0.9996344852565837,lr,180
L603,-0.00038456777494131944,Nail dystrophy,0.9996155061617672,lr,180
8244,-0.0003971768982266335,"Bimalleolar fracture, closed",0.9996029019660763,lr,180
5183,-0.0004263874339339278,Pulmonary eosinophilia,0.9995737034562694,lr,180
59780,-0.0004607901352929765,"Urethritis, unspecified",0.9995393160121769,lr,180
C9202,-0.0005521820290530642,"Acute myeloblastic leukemia, in relapse",0.9994479703953869,lr,180
8820,-0.0005701414110572897,"Open wound of hand except finger(s) alone, without mention of complication",0.999430021088673,lr,180
75453,-0.0006088901866720583,Metatarsus varus,0.9993912951493393,lr,180
99811,-0.0006204341201961703,Hemorrhage complicating a procedure,0.999379758309254,lr,180
6989,-0.0006404388571082666,Unspecified pruritic disorder,0.9993597661800829,lr,180
C01,-0.0006660283448289889,Malignant neoplasm of base of tongue,0.9993341934028163,lr,180
56942,-0.0007574966689450242,Anal or rectal pain,0.9992427901592283,lr,180
B079,-0.000818806411339912,"Viral wart, unspecified",0.9991815287191544,lr,180
7241,-0.00082490574121026,Pain in thoracic spine,0.9991754343999961,lr,180
8460,-0.0008341916370744262,Sprain of lumbosacral (joint) (ligament),0.9991661562040405,lr,180
D89811,-0.0008525793682206648,Chronic graft-versus-host disease,0.9991477839743022,lr,180
C9112,-0.0008863252276776592,Chronic lymphocytic leukemia of B-cell type in relapse,0.9991140674425072,lr,180
C4921,-0.0008956691229978483,"Malignant neoplasm of connective and soft tissue of right lower limb, including hip",0.9991047318688635,lr,180
D619,-0.0009601711398873182,"Aplastic anemia, unspecified",0.9990402896769222,lr,180
C714,-0.0009618420315410584,Malignant neoplasm of occipital lobe,0.9990386203902349,lr,180
Z596,-0.0010048219749825794,Low income,0.9989956826895713,lr,180
C9101,-0.0010921050260531855,"Acute lymphoblastic leukemia, in remission",0.998908491103609,lr,180
C3402,-0.0011018025331392027,Malignant neoplasm of left main bronchus,0.9988988042284076,lr,180
F429,-0.0011717099828886194,"Obsessive-compulsive disorder, unspecified",0.9988289762012242,lr,180
56722,-0.0011990696876077673,Peritoneal abscess,0.9988016489092055,lr,180
V1043,-0.0012099427058180326,Personal history of malignant neoplasm of ovary,0.9987907889797287,lr,180
29645,-0.001216759866875324,"Bipolar I disorder, most recent episode (or current) manic, in partial or unspecified remission",0.9987839800852664,lr,180
R828,-0.0012191920126893166,Abnormal findings on cytological and histological examination of urine,0.9987815508999442,lr,180
70713,-0.0012446023249435521,Ulcer of ankle,0.9987561718713079,lr,180
Z952,-0.001246043403996997,Presence of prosthetic heart valve,0.9987547325857462,lr,180
32752,-0.0012673569911116195,Sleep related leg cramps,0.9987334457665972,lr,180
D89813,-0.0012828608148067343,"Graft-versus-host disease, unspecified",0.998717961699367,lr,180
33700,-0.0013070388210294289,"Idiopathic peripheral autonomic neuropathy, unspecified",0.9986938149821852,lr,180
9130,-0.0013122527977342086,"Abrasion or friction burn of elbow, forearm, and wrist, without mention of infection",0.9986886078294738,lr,180
V8530,-0.0013363912635704074,"Body Mass Index 30.0-30.9, adult",0.998664501309581,lr,180
1414,-0.0013394257948184613,"Malignant neoplasm of anterior two-thirds of tongue, part unspecified",0.9986614708355435,lr,180
C519,-0.0013546653672947915,"Malignant neoplasm of vulva, unspecified",0.9986462517776457,lr,180
E042,-0.0013877632402758274,Nontoxic multinodular goiter,0.9986131992578384,lr,180
C678,-0.0014022192965126065,Malignant neoplasm of overlapping sites of bladder,0.9985987633536145,lr,180
V113,-0.0014360558721162341,Personal history of alcoholism,0.9985649747627089,lr,180
3541,-0.0014363340468118225,Other lesion of median nerve,0.9985646969872397,lr,180
T8649,-0.001465905501386708,Other complications of liver transplant,0.9985351684132662,lr,180
F17219,-0.0014846828320960405,"Nicotine dependence, cigarettes, with unspecified nicotine-induced disorders",0.9985164187642188,lr,180
C211,-0.0015349160991001917,Malignant neoplasm of anal canal,0.9984662612821446,lr,180
24291,-0.0015471627788950074,"Thyrotoxicosis without mention of goiter or other cause, with mention of thyrotoxic crisis or storm",0.998454033460432,lr,180
E9300,-0.0015840454655732554,Penicillins causing adverse effects in therapeutic use,0.9984172084722597,lr,180
C5700,-0.0015924051170027951,Malignant neoplasm of unspecified fallopian tube,0.9984088620873021,lr,180
C50312,-0.0015958821968127162,Malignant neoplasm of lower-inner quadrant of left female breast,0.998405390546041,lr,180
Z96611,-0.0016011076350785582,Presence of right artificial shoulder joint,0.9984001734539393,lr,180
2554,-0.0016099379437778422,Corticoadrenal insufficiency,0.9983913573111269,lr,180
78703,-0.0016247585181279264,Vomiting alone,0.998376560687433,lr,180
I270,-0.0016302509241521211,Primary pulmonary hypertension,0.9983710772130554,lr,180
M86172,-0.0016332355239357754,"Other acute osteomyelitis, left ankle and foot",0.998368097479401,lr,180
20158,-0.0016402846821624711,"Hodgkin's disease, nodular sclerosis, lymph nodes of multiple sites",0.9983610598495181,lr,180
28860,-0.0016673997492086345,"Leukocytosis, unspecified",0.9983339895894516,lr,180
5959,-0.0016688886057502894,"Cystitis, unspecified",0.998332503214467,lr,180
23877,-0.0016697586939660016,Post-transplant lymphoproliferative disorder (PTLD),0.9983316345774984,lr,180
60886,-0.0016908244063802984,Edema of male genital organs,0.9983106042319007,lr,180
39890,-0.0017261081082726598,"Rheumatic heart disease, unspecified",0.9982753807595559,lr,180
C50311,-0.0017272033618261733,Malignant neoplasm of lower-inner quadrant of right female breast,0.9982742873954965,lr,180
42831,-0.0017423173006776242,Acute diastolic heart failure,0.9982591996529777,lr,180
C342,-0.001753376039040401,"Malignant neoplasm of middle lobe, bronchus or lung",0.9982481602267117,lr,180
07030,-0.0017664599795788052,"Viral hepatitis B without mention of hepatic coma, acute or unspecified, without mention of hepatitis delta",0.9982350992925851,lr,180
E8147,-0.0017702519632114052,Motor vehicle traffic accident involving collision with pedestrian injuring pedestrian,0.998231314008604,lr,180
C482,-0.0018440704546662102,"Malignant neoplasm of peritoneum, unspecified",0.9981576287985799,lr,180
C180,-0.0018467944655729028,Malignant neoplasm of cecum,0.9981549098100158,lr,180
25040,-0.0018485044886204017,"Diabetes with renal manifestations, type II or unspecified type, not stated as uncontrolled",0.9981532029435745,lr,180
F250,-0.001851768189381543,"Schizoaffective disorder, bipolar type",0.9981499452755223,lr,180
29626,-0.001894637462630032,"Major depressive affective disorder, single episode, in full remission",0.9981071562299495,lr,180
7835,-0.001916420737490036,Polydipsia,0.9980854144242303,lr,180
F4312,-0.001945495397529118,"Post-traumatic stress disorder, chronic",0.9980563958519706,lr,180
S42202D,-0.0019671935459380312,"Unspecified fracture of upper end of left humerus, subsequent encounter for fracture with routine healing",0.9980347401111185,lr,180
3553,-0.0019750455422184805,Lesion of lateral popliteal nerve,0.9980269035768177,lr,180
2800,-0.001981085617975081,Iron deficiency anemia secondary to blood loss (chronic),0.9980208754369182,lr,180
C713,-0.002008880905018099,Malignant neoplasm of parietal lobe,0.9979931355457313,lr,180
Z96612,-0.002017540922419377,Presence of left artificial shoulder joint,0.9979844929452337,lr,180
D7581,-0.0020179384904962802,Myelofibrosis,0.997984096178537,lr,180
25061,-0.0020364973721532505,"Diabetes with neurological manifestations, type I [juvenile type], not stated as uncontrolled",0.9979655748816683,lr,180
R570,-0.0020381469536956427,Cardiogenic shock,0.9979639286574338,lr,180
29600,-0.002048078406713377,"Bipolar I disorder, single manic episode, unspecified",0.9979540174747793,lr,180
C8339,-0.0020741479528937463,"Diffuse large B-cell lymphoma, extranodal and solid organ sites",0.9979280016055473,lr,180
J3081,-0.0020886746582133788,Allergic rhinitis due to animal (cat) (dog) hair and dander,0.9979135051048311,lr,180
Z433,-0.002103938863186345,Encounter for attention to colostomy,0.9978982728647983,lr,180
1736,-0.002110882620468188,"Other and unspecified malignant neoplasm of skin of upper limb, including shoulder",0.9978913437254566,lr,180
C8338,-0.0021325142740596884,"Diffuse large B-cell lymphoma, lymph nodes of multiple sites",0.9978697579190564,lr,180
2399,-0.0021364313236970855,"Neoplasm of unspecified nature, site unspecified",0.9978658492213383,lr,180
C50811,-0.0021681212051305678,Malignant neoplasm of overlapping sites of right female breast,0.9978342274719374,lr,180
J9621,-0.002174613514625837,Acute and chronic respiratory failure with hypoxia,0.9978277492443369,lr,180
E8498,-0.0022547940475278693,Accidents occurring in other specified places,0.9977477460910488,lr,180
1745,-0.0022572735058101804,Malignant neoplasm of lower-outer quadrant of female breast,0.9977452722202029,lr,180
28260,-0.002258631619377349,"Sickle-cell disease, unspecified",0.9977439171697323,lr,180
F29,-0.0022603652372122354,Unspecified psychosis not due to a substance or known physiological condition,0.9977421874645822,lr,180
C50111,-0.0022625983803537058,Malignant neoplasm of central portion of right female breast,0.9977399593659472,lr,180
M315,-0.002265551234935724,Giant cell arteritis with polymyalgia rheumatica,0.9977370131892863,lr,180
S52572D,-0.002272358544537946,"Other intraarticular fracture of lower end of left radius, subsequent encounter for closed fracture with routine healing",0.9977302213076531,lr,180
J4550,-0.002300547684055135,"Severe persistent asthma, uncomplicated",0.9977020965476524,lr,180
C9002,-0.002308805587631347,Multiple myeloma in relapse,0.9976938576539595,lr,180
99831,-0.0023135537969212576,Disruption of internal operation (surgical) wound,0.9976891204059627,lr,180
C8310,-0.0023186214125354284,"Mantle cell lymphoma, unspecified site",0.9976840645138088,lr,180
C884,-0.0023410034116193696,Extranodal marginal zone B-cell lymphoma of mucosa-associated lymphoid tissue [MALT-lymphoma],0.9976617345998857,lr,180
4466,-0.0023573927647373024,Thrombotic microangiopathy,0.9976453837034158,lr,180
04104,-0.0023580860172115956,"Streptococcus infection in conditions classified elsewhere and of unspecified site, streptococcus, group D [Enterococcus]",0.9976446920835248,lr,180
I70245,-0.002365974539490927,Atherosclerosis of native arteries of left leg with ulceration of other part of foot,0.9976368221721855,lr,180
9054,-0.0023752819698779253,Late effect of fracture of lower extremities,0.9976275367801233,lr,180
17361,-0.0023879128240214625,"Basal cell carcinoma of skin of upper limb, including shoulder",0.9976149359717963,lr,180
C50511,-0.002389272893193483,Malignant neoplasm of lower-outer quadrant of right female breast,0.997613579147399,lr,180
E1142,-0.002393864963392415,Type 2 diabetes mellitus with diabetic polyneuropathy,0.9976089980463305,lr,180
G6181,-0.0024018747796475132,Chronic inflammatory demyelinating polyneuritis,0.9976010074135635,lr,180
M86171,-0.0024110134688918243,"Other acute osteomyelitis, right ankle and foot",0.9975918906896245,lr,180
K5720,-0.002425812830829785,Diverticulitis of large intestine with perforation and abscess without bleeding,0.9975771270754141,lr,180
C210,-0.00248249696812899,"Malignant neoplasm of anus, unspecified",0.9975205818791993,lr,180
C19,-0.002485826593745214,Malignant neoplasm of rectosigmoid junction,0.9975172605146467,lr,180
Y92129,-0.0024888462872580132,Unspecified place in nursing home as the place of occurrence of the external cause,0.9975142483227941,lr,180
7517,-0.0024937364984805787,Anomalies of pancreas,0.9975093702793497,lr,180
6100,-0.0024985464286721016,Solitary cyst of breast,0.9975045723404521,lr,180
C9200,-0.0025017639910799327,"Acute myeloblastic leukemia, not having achieved remission",0.997501362812402,lr,180
Y842,-0.002511786072782632,"Radiological procedure and radiotherapy as the cause of abnormal reaction of the patient, or of later complication, without mention of misadventure at the time of the procedure",0.9974913658223407,lr,180
V6441,-0.002537469192571208,Laparoscopic surgical procedure converted to open procedure,0.9974657474610853,lr,180
J3801,-0.0025507214180988513,"Paralysis of vocal cords and larynx, unilateral",0.9974525289076317,lr,180
I70235,-0.0025520948286190345,Atherosclerosis of native arteries of right leg with ulceration of other part of foot,0.9974511589967758,lr,180
C712,-0.002568015286536443,Malignant neoplasm of temporal lobe,0.9974352792439812,lr,180
D471,-0.0025722198401260227,Chronic myeloproliferative disease,0.9974310854827139,lr,180
C55,-0.0025953860254522123,"Malignant neoplasm of uterus, part unspecified",0.9974079790769822,lr,180
D6861,-0.0026100110953533057,Antiphospholipid syndrome,0.9973933920222369,lr,180
0311,-0.0026126777707832977,Cutaneous diseases due to other mycobacteria,0.9973907323013307,lr,180
Z79891,-0.00262037391481904,Long term (current) use of opiate analgesic,0.997383056268133,lr,180
30789,-0.0026226059184388515,Other pain disorders related to psychological factors,0.9973808301080254,lr,180
I462,-0.0026294907701485577,Cardiac arrest due to underlying cardiac condition,0.9973739633125505,lr,180
2270,-0.0026322015222202313,Benign neoplasm of adrenal gland,0.9973712596826776,lr,180
85201,-0.002650470610653335,"Subarachnoid hemorrhage following injury without mention of open intracranial wound, with no loss of consciousness",0.997353038785374,lr,180
M65841,-0.002653866265838022,"Other synovitis and tenosynovitis, right hand",0.9973496521241068,lr,180
5811,-0.002668387586070344,Nephrotic syndrome with lesion of membranous glomerulonephritis,0.9973351693955791,lr,180
M009,-0.002686960700199843,"Pyogenic arthritis, unspecified",0.9973166459476721,lr,180
M1710,-0.002693471039420743,"Unilateral primary osteoarthritis, unspecified knee",0.9973101530991317,lr,180
9950,-0.0026935222553625886,Other anaphylactic reaction,0.9973101020209543,lr,180
430,-0.0027010376132620014,Subarachnoid hemorrhage,0.9973026069067651,lr,180
J3800,-0.0027074034905507217,"Paralysis of vocal cords and larynx, unspecified",0.9972962582209574,lr,180
1611,-0.0027129129478364335,Malignant neoplasm of supraglottis,0.9972907636749575,lr,180
7873,-0.002718109767621763,"Flatulence, eructation, and gas pain",0.997285580948052,lr,180
S72002D,-0.0027198643478321604,"Fracture of unspecified part of neck of left femur, subsequent encounter for closed fracture with routine healing",0.9972838311320426,lr,180
M7660,-0.0027516648029402755,"Achilles tendinitis, unspecified leg",0.9972521175565964,lr,180
F3181,-0.0027745753098074454,Bipolar II disorder,0.9972292702668313,lr,180
78729,-0.0027760987819086926,Other dysphagia,0.9972277510170168,lr,180
78451,-0.002793745579209459,Dysarthria,0.997210153296304,lr,180
E1022,-0.0027987910283828322,Type 1 diabetes mellitus with diabetic chronic kidney disease,0.9972051219358531,lr,180
E1152,-0.0028150412141802806,Type 2 diabetes mellitus with diabetic peripheral angiopathy with gangrene,0.997188917299008,lr,180
Z48290,-0.0028189567760322463,Encounter for aftercare following bone marrow transplant,0.9971850127517685,lr,180
R498,-0.0028286435358445337,Other voice and resonance disorders,0.997175353306846,lr,180
M7522,-0.0028303247865258626,"Bicipital tendinitis, left shoulder",0.9971736768065131,lr,180
5110,-0.002837490497955135,Pleurisy without mention of effusion or current tuberculosis,0.9971665313733014,lr,180
E662,-0.0028402845233624,Morbid (severe) obesity with alveolar hypoventilation,0.9971637452685697,lr,180
B957,-0.002852469249014685,Other staphylococcus as the cause of diseases classified elsewhere,0.9971515951759261,lr,180
M0589,-0.002864462009139125,Other rheumatoid arthritis with rheumatoid factor of multiple sites,0.9971396366477455,lr,180
M459,-0.0028653743206380083,Ankylosing spondylitis of unspecified sites in spine,0.997138726946204,lr,180
C549,-0.0028661494940683424,"Malignant neoplasm of corpus uteri, unspecified",0.997137953991056,lr,180
Z931,-0.0028857272556482515,Gastrostomy status,0.9971184324530251,lr,180
J910,-0.002890867095324429,Malignant pleural effusion,0.9971133074373151,lr,180
I8291,-0.002903385644975035,Chronic embolism and thrombosis of unspecified vein,0.9971008251029991,lr,180
Y830,-0.002908286264587677,"Surgical operation with transplant of whole organ as the cause of abnormal reaction of the patient, or of later complication, without mention of misadventure at the time of the procedure",0.9970959387031131,lr,180
M65311,-0.0029087827942658457,"Trigger thumb, right thumb",0.9970954436155105,lr,180
L97522,-0.002930790781021832,Non-pressure chronic ulcer of other part of left foot with fat layer exposed,0.9970734997936634,lr,180
F22,-0.0029468906767723055,Delusional disorders,0.9970574471434845,lr,180
29652,-0.0029504594043767,"Bipolar I disorder, most recent episode (or current) depressed, moderate",0.997053888923399,lr,180
E032,-0.002951079056124849,Hypothyroidism due to medicaments and other exogenous substances,0.997053271097405,lr,180
I972,-0.00295282512386306,Postmastectomy lymphedema syndrome,0.997051530176375,lr,180
E1159,-0.002966605148267291,Type 2 diabetes mellitus with other circulatory complications,0.997037790876621,lr,180
33119,-0.0029832863944370303,Other frontotemporal dementia,0.99702115918251,lr,180
K9189,-0.002989817074057369,Other postprocedural complications and disorders of digestive system,0.997014647978006,lr,180
C50112,-0.0029956822889591886,Malignant neoplasm of central portion of left female breast,0.9970088002899844,lr,180
S72001D,-0.003001236631125171,"Fracture of unspecified part of neck of right femur, subsequent encounter for closed fracture with routine healing",0.9970032625773443,lr,180
I4901,-0.00301081273204774,Ventricular fibrillation,0.996993715219195,lr,180
C494,-0.0030112133103087726,Malignant neoplasm of connective and soft tissue of abdomen,0.9969933158452663,lr,180
2884,-0.0030143171698497817,Hemophagocytic syndromes,0.9969902213228531,lr,180
7265,-0.0030264638004688653,Enthesopathy of hip region,0.9969781113244518,lr,180
V709,-0.0030374096102858497,Unspecified general medical examination,0.9969671986513776,lr,180
C7A8,-0.0030544020800682948,Other malignant neuroendocrine tumors,0.9969502578603139,lr,180
T847XXA,-0.0030749168503093976,"Infection and inflammatory reaction due to other internal orthopedic prosthetic devices, implants and grafts, initial encounter",0.9969298058646168,lr,180
C9111,-0.0030768361196675887,Chronic lymphocytic leukemia of B-cell type in remission,0.9969278924896242,lr,180
J9691,-0.0030826521183200777,"Respiratory failure, unspecified with hypoxia",0.9969220943752057,lr,180
C169,-0.0030828673470487404,"Malignant neoplasm of stomach, unspecified",0.996921879808954,lr,180
2326,-0.0031294393434978885,"Carcinoma in situ of skin of upper limb, including shoulder",0.9968754522478279,lr,180
M359,-0.0031420289524976357,"Systemic involvement of connective tissue, unspecified",0.9968629020546638,lr,180
28983,-0.0031524952873612064,Myelofibrosis,0.9968524686083179,lr,180
Z933,-0.003157393040664831,Colostomy status,0.9968475862828028,lr,180
Z9079,-0.0031837472928211057,Acquired absence of other genital organ(s),0.996821315456328,lr,180
