feature,weight,feature_desc,odds_ratio,model,cutoff
30550,-0.019407730913365416,"Opioid abuse, unspecified",0.9807793866320151,lr,180
8088,-0.01941432848307947,Closed unspecified fracture of pelvis,0.9807729158929833,lr,180
2250,-0.019434180819408807,Benign neoplasm of brain,0.9807534454524618,lr,180
V064,-0.019479245894071885,Need for prophylactic vaccination and inoculation against measles-mumps-rubella (MMR),0.9807092487210884,lr,180
08881,-0.019488237292411708,Lyme Disease,0.9807004308132203,lr,180
36283,-0.01949338478705963,Retinal edema,0.9806953826759942,lr,180
99739,-0.019503237777791525,Other respiratory complications,0.9806857199410813,lr,180
R102,-0.019506880104383718,Pelvic and perineal pain,0.9806821479699102,lr,180
64683,-0.019521938524765754,"Other specified complications of pregnancy, antepartum condition or complication",0.9806673805570522,lr,180
193,-0.01954202721953914,Malignant neoplasm of thyroid gland,0.9806476804272455,lr,180
64511,-0.019560599594935797,"Post term pregnancy, delivered, with or without mention of antepartum condition",0.9806294676395206,lr,180
5081,-0.019576339625823346,Chronic and other pulmonary manifestations due to radiation,0.9806140326228848,lr,180
V0261,-0.01958887495821254,Hepatitis B carrier,0.9806017403770843,lr,180
53089,-0.019589677577004777,Other specified disorders of esophagus,0.9806009533280157,lr,180
I341,-0.019592656498133094,Nonrheumatic mitral (valve) prolapse,0.9805980321994682,lr,180
R41840,-0.019596738258051586,Attention and concentration deficit,0.980594029641893,lr,180
M797,-0.01960649007336608,Fibromyalgia,0.9805844671166435,lr,180
Z96651,-0.019631534295533454,Presence of right artificial knee joint,0.9805599094489102,lr,180
17392,-0.01963661476452245,"Squamous cell carcinoma of skin, site unspecified",0.9805549277573531,lr,180
99931,-0.01964565753562477,Other and unspecified infection due to central venous catheter,0.9805460608636789,lr,180
60010,-0.019655951990392998,Nodular prostate without urinary obstruction,0.980535966728564,lr,180
5272,-0.019659100885279123,Sialoadenitis,0.980532879128734,lr,180
R1312,-0.019663006610139235,"Dysphagia, oropharyngeal phase",0.9805290494445706,lr,180
36570,-0.01967141617597797,"Glaucoma stage, unspecified",0.9805208036556444,lr,180
7109,-0.019674409427464977,Unspecified diffuse connective tissue disease,0.9805178687146833,lr,180
43490,-0.019694920788561696,"Cerebral artery occlusion, unspecified without mention of cerebral infarction",0.9804977571648746,lr,180
V066,-0.019700424078170662,Need for prophylactic vaccination and inoculation against streptococcus pneumoniae [pneumococcus] and influenza,0.9804923612166038,lr,180
C220,-0.019704032768252003,Liver cell carcinoma,0.9804888229299293,lr,180
58181,-0.019737813342237568,Nephrotic syndrome in diseases classified elsewhere,0.9804557020141292,lr,180
42841,-0.019751478271446854,Acute combined systolic and diastolic heart failure,0.9804423042479083,lr,180
2152,-0.019759411977063917,"Other benign neoplasm of connective and other soft tissue of upper limb, including shoulder",0.9804345257381482,lr,180
2305,-0.01977261018553392,Carcinoma in situ of anal canal,0.9804215858442782,lr,180
V0251,-0.019800916584574856,Carrier or suspected carrier of group B streptococcus,0.9803938340324198,lr,180
7946,-0.019830778303661964,Nonspecific abnormal results of other endocrine function study,0.9803645582242683,lr,180
5720,-0.01983220977559632,Abscess of liver,0.9803631548609222,lr,180
75611,-0.01983839492404474,"Spondylolysis, lumbosacral region",0.9803570911880284,lr,180
8730,-0.019868296992427346,"Open wound of scalp, without mention of complication",0.9803277769215291,lr,180
C44310,-0.01987736534304932,Basal cell carcinoma of skin of unspecified parts of face,0.980318887005832,lr,180
7992,-0.019888459313272204,Signs and symptoms involving emotional state,0.9803080114376174,lr,180
51630,-0.019907803458544194,"Idiopathic interstitial pneumonia, not otherwise specified",0.9802890484004453,lr,180
F319,-0.019917702003877533,"Bipolar disorder, unspecified",0.9802793450128847,lr,180
57142,-0.01993713903564872,Autoimmune hepatitis,0.9802602914772838,lr,180
E8798,-0.01996264569094518,"Other specified procedures as the cause of abnormal reaction of patient, or of later complication, without mention of misadventure at time of procedure",0.980235288634799,lr,180
3368,-0.019988597635497683,Other myelopathy,0.9802098499530331,lr,180
J310,-0.020004546473297306,Chronic rhinitis,0.9801942168697916,lr,180
04102,-0.020008703875101088,"Streptococcus infection in conditions classified elsewhere and of unspecified site, streptococcus, group B",0.9801901418170571,lr,180
V7285,-0.020025831398416245,Other specified examination,0.9801733537313194,lr,180
37210,-0.020032005454571147,"Chronic conjunctivitis, unspecified",0.9801673021046735,lr,180
7829,-0.020070359204577354,Other symptoms involving skin and integumentary tissues,0.9801297097339132,lr,180
1982,-0.02007340975893539,Secondary malignant neoplasm of skin,0.9801267197995162,lr,180
87343,-0.02008293361742455,"Open wound of lip, without mention of complication",0.9801173852557858,lr,180
R946,-0.020095941462160333,Abnormal results of thyroid function studies,0.9801046361239352,lr,180
1990,-0.020099527247388373,Disseminated malignant neoplasm without specification of site,0.98010112168551,lr,180
2180,-0.020123657733099702,Submucous leiomyoma of uterus,0.980077471654742,lr,180
E9426,-0.020136733434600478,Other antihypertensive agents causing adverse effects in therapeutic use,0.9800646565380585,lr,180
3970,-0.02015439276459683,Diseases of tricuspid valve,0.9800473494056876,lr,180
53240,-0.02016604694870694,"Chronic or unspecified duodenal ulcer with hemorrhage, without mention of obstruction",0.9800359278199958,lr,180
M461,-0.02016781953076954,"Sacroiliitis, not elsewhere classified",0.9800341906274291,lr,180
G3184,-0.020207993239526146,"Mild cognitive impairment, so stated",0.9799948198101245,lr,180
0940,-0.020209369480731283,Tabes dorsalis,0.9799934711018007,lr,180
501,-0.020232428377196413,Asbestosis,0.9799708737943496,lr,180
0340,-0.020251157144573238,Streptococcal sore throat,0.9799525203196877,lr,180
6160,-0.020287136364625657,Cervicitis and endocervicitis,0.979917263026587,lr,180
7018,-0.020339427789983856,Other specified hypertrophic and atrophic conditions of skin,0.9798660230958864,lr,180
Z923,-0.020374368899556926,Personal history of irradiation,0.9798317860879495,lr,180
8240,-0.020387158413208293,"Fracture of medial malleolus, closed",0.9798192545960813,lr,180
J441,-0.02038750139865955,Chronic obstructive pulmonary disease with (acute) exacerbation,0.9798189185323897,lr,180
72633,-0.020406243418467484,Olecranon bursitis,0.9798005549188965,lr,180
30490,-0.02042044409077414,"Unspecified drug dependence, unspecified",0.9797866411910826,lr,180
R739,-0.020499780813586974,"Hyperglycemia, unspecified",0.9797089112133763,lr,180
1963,-0.020500638779598627,Secondary and unspecified malignant neoplasm of lymph nodes of axilla and upper limb,0.9797080706567898,lr,180
71901,-0.020513830105521776,"Effusion of joint, shoulder region",0.9796951470935599,lr,180
V1002,-0.020515279858257178,Personal history of malignant neoplasm of other and unspecified oral cavity and pharynx,0.9796937267788701,lr,180
6108,-0.02051702823766742,Other specified benign mammary dysplasias,0.9796920139040273,lr,180
C189,-0.02052207999301957,"Malignant neoplasm of colon, unspecified",0.9796870647521535,lr,180
2396,-0.020522579005293622,Neoplasm of unspecified nature of brain,0.9796865758764054,lr,180
92411,-0.020537614220279478,Contusion of knee,0.9796718461888506,lr,180
71956,-0.02054470896530988,"Stiffness of joint, not elsewhere classified, lower leg",0.9796648956915445,lr,180
42840,-0.020549619640651717,"Combined systolic and diastolic heart failure, unspecified",0.9796600848871101,lr,180
37214,-0.020568561818566096,Other chronic allergic conjunctivitis,0.9796415281672395,lr,180
4564,-0.02057566664139997,Scrotal varices,0.9796345680124665,lr,180
6924,-0.020644169690365616,Contact dermatitis and other eczema due to other chemical products,0.9795674623561827,lr,180
47831,-0.020685030105152605,"Unilateral paralysis of vocal cords or larynx, partial",0.9795274376410779,lr,180
7960,-0.020689723845810637,Nonspecific abnormal toxicological findings,0.9795228400041083,lr,180
83100,-0.020692938913745445,"Closed dislocation of shoulder, unspecified",0.9795196907766964,lr,180
40391,-0.02069618936208077,"Hypertensive chronic kidney disease, unspecified, with chronic kidney disease stage V or end stage renal disease",0.9795165069037226,lr,180
29689,-0.020727336157855943,Other bipolar disorders,0.9794859985782445,lr,180
1918,-0.02073770815378619,Malignant neoplasm of other parts of brain,0.979475839406139,lr,180
2971,-0.020745970965129226,Delusional disorder,0.9794677462154993,lr,180
1976,-0.020746351518072307,Secondary malignant neoplasm of retroperitoneum and peritoneum,0.9794673734762367,lr,180
V769,-0.020755646246863345,Special screening for unspecified malignant neoplasms,0.9794582696349494,lr,180
71659,-0.02078466551788426,"Unspecified polyarthropathy or polyarthritis, multiple sites",0.979429846882375,lr,180
Z136,-0.020795903050886595,Encounter for screening for cardiovascular disorders,0.9794188405689892,lr,180
82381,-0.020807419515819135,Closed fracture of unspecified part of fibula alone,0.979407561191207,lr,180
Z853,-0.020845603181471835,Personal history of malignant neoplasm of breast,0.979370164534328,lr,180
6102,-0.0208611562252053,Fibroadenosis of breast,0.9793549324657805,lr,180
V1302,-0.020871439772688148,"Personal history, urinary (tract) infection",0.9793448612746138,lr,180
65421,-0.020894071203170956,"Previous cesarean delivery, delivered, with or without mention of antepartum condition",0.9793226975502666,lr,180
V4975,-0.020904573898676924,Below knee amputation status,0.9793124120761848,lr,180
M19011,-0.020932356397118285,"Primary osteoarthritis, right shoulder",0.9792852047085687,lr,180
42821,-0.020934417613026616,Acute systolic heart failure,0.9792831861924063,lr,180
I214,-0.020980002218997217,Non-ST elevation (NSTEMI) myocardial infarction,0.9792385469716685,lr,180
3682,-0.02101894816627076,Diplopia,0.9792004103414883,lr,180
73392,-0.021020217404705128,Chondromalacia,0.9791991675034812,lr,180
Z981,-0.021029029697563966,Arthrodesis status,0.9791905385516706,lr,180
99667,-0.021038365824374298,"Infection and inflammatory reaction due to other internal orthopedic device, implant, and graft",0.9791813967473058,lr,180
36846,-0.021039121889850004,Homonymous bilateral field defects,0.9791806564223371,lr,180
42830,-0.02104392396638946,"Diastolic heart failure, unspecified",0.979175954333169,lr,180
E118,-0.021052334584931887,Type 2 diabetes mellitus with unspecified complications,0.9791677188923638,lr,180
71902,-0.0210586014652471,"Effusion of joint, upper arm",0.9791615825846887,lr,180
179,-0.021065232100538716,"Malignant neoplasm of uterus, part unspecified",0.9791550901428675,lr,180
7048,-0.021081760153111754,Other specified diseases of hair and hair follicles,0.9791389067498009,lr,180
53510,-0.021085875874883385,"Atrophic gastritis, without mention of hemorrhage",0.9791348768947777,lr,180
45381,-0.02109795846490147,Acute venous embolism and thrombosis of superficial veins of upper extremity,0.979123046480959,lr,180
2725,-0.02110335767308843,Lipoprotein deficiencies,0.9791177600060618,lr,180
V8522,-0.021128611092385136,"Body Mass Index 26.0-26.9, adult",0.9790930342469338,lr,180
D519,-0.02113774797628058,"Vitamin B12 deficiency anemia, unspecified",0.9790840884284255,lr,180
42090,-0.02115567235752904,"Acute pericarditis, unspecified",0.9790665391092311,lr,180
R2681,-0.0211648487430448,Unsteadiness on feet,0.9790575548584441,lr,180
71948,-0.02120307930541061,"Pain in joint, other specified sites",0.9790201256530078,lr,180
Z4789,-0.021253961052276345,Encounter for other orthopedic aftercare,0.9789703126660945,lr,180
V7799,-0.021275188546534138,"Screening for other and unspecified endocrine, nutritional, metabolic, and immunity disorders",0.9789495317999675,lr,180
V6889,-0.021277876539601386,Encounters for other specified administrative purpose,0.9789469003939494,lr,180
V531,-0.02127845766183711,Fitting and adjustment of spectacles and contact lenses,0.9789463315063033,lr,180
R569,-0.02132390972167323,Unspecified convulsions,0.9789018373902496,lr,180
29650,-0.02132436225202446,"Bipolar I disorder, most recent episode (or current) depressed, unspecified",0.9789013944075575,lr,180
Y929,-0.02134430926174331,Unspecified place or not applicable,0.9788818684466725,lr,180
J40,-0.021350020341324227,"Bronchitis, not specified as acute or chronic",0.9788762779903852,lr,180
I25119,-0.02135902376457995,Atherosclerotic heart disease of native coronary artery with unspecified angina pectoris,0.978867464792614,lr,180
27503,-0.021376132625587504,Other hemochromatosis,0.9788507176284769,lr,180
79508,-0.02141061845843627,Unsatisfactory cervical cytology smear,0.9788169617282984,lr,180
V6289,-0.021438255273221157,"Other psychological or physical stress, not elsewhere classified",0.9787899107190223,lr,180
7200,-0.021462139300292796,Ankylosing spondylitis,0.9787665335534689,lr,180
84509,-0.02148035381834096,Other sprains and strains of ankle,0.9787487059551395,lr,180
5710,-0.021490594785119922,Alcoholic fatty liver,0.9787386826734811,lr,180
34510,-0.02149578247014649,"Generalized convulsive epilepsy, without mention of intractable epilepsy",0.978733605298642,lr,180
5829,-0.021498985007981097,Chronic glomerulonephritis with unspecified pathological lesion in kidney,0.9787304708722601,lr,180
71981,-0.0215317154416996,"Other specified disorders of joint, shoulder region",0.978698437123697,lr,180
V4972,-0.0215358812477052,Other toe(s) amputation status,0.9786943600643621,lr,180
2572,-0.02159499903739407,Other testicular hypofunction,0.9786365035272062,lr,180
K7030,-0.021657617265563416,Alcoholic cirrhosis of liver without ascites,0.9785752249619312,lr,180
95901,-0.02167063445487111,"Head injury, unspecified",0.9785624867458841,lr,180
28522,-0.0216740903530354,Anemia in neoplastic disease,0.978559104939426,lr,180
N644,-0.0216977373912207,Mastodynia,0.9785359651884994,lr,180
R9431,-0.021753132292270286,Abnormal electrocardiogram [ECG] [EKG],0.9784817607868719,lr,180
Z471,-0.021763734382380547,Aftercare following joint replacement surgery,0.9784713868900653,lr,180
66331,-0.02177981858794555,"Other and unspecified cord entanglement, without mention of compression, complicating labor and delivery, delivered, with or without mention of antepartum condition",0.9784556490817046,lr,180
V770,-0.021780972525559078,Screening for thyroid disorders,0.9784545200055793,lr,180
J479,-0.02180768070437126,"Bronchiectasis, uncomplicated",0.9784283876162753,lr,180
99520,-0.02180948642001592,"Unspecified adverse effect of unspecified drug, medicinal and biological substance",0.9784266208544237,lr,180
R0781,-0.02181545616198102,Pleurodynia,0.9784207799173998,lr,180
7289,-0.021881167441280668,"Unspecified disorder of muscle, ligament, and fascia",0.9783564887486087,lr,180
99659,-0.021925905434254014,"Mechanical complication due to other implant and internal device, not elsewhere classified",0.9783127200219595,lr,180
H538,-0.021959258066560863,Other visual disturbances,0.978280091261658,lr,180
71996,-0.021980033494542927,"Unspecified disorder of joint, lower leg",0.9782597672851961,lr,180
K900,-0.021981729338836783,Celiac disease,0.9782581083103585,lr,180
R3915,-0.021985029811072764,Urgency of urination,0.9782548796019606,lr,180
44101,-0.021986003428345155,"Dissection of aorta, thoracic",0.9782539271565767,lr,180
G40209,-0.022002258265162833,"Localization-related (focal) (partial) symptomatic epilepsy and epileptic syndromes with complex partial seizures, not intractable, without status epilepticus",0.9782380259278607,lr,180
F1010,-0.022012964438169042,"Alcohol abuse, uncomplicated",0.9782275527983776,lr,180
G250,-0.02208963683092727,Essential tremor,0.9781525526265006,lr,180
E210,-0.022091125743508442,Primary hyperparathyroidism,0.9781510962439428,lr,180
M791,-0.022120877106483694,Myalgia,0.9781219953485316,lr,180
2397,-0.022125372325974668,Neoplasm of unspecified nature of endocrine glands and other parts of nervous system,0.9781175984853561,lr,180
5728,-0.022158862011048074,Other sequelae of chronic liver disease,0.9780848421835202,lr,180
1911,-0.022185676879017086,Malignant neoplasm of frontal lobe,0.9780586153192511,lr,180
29633,-0.02218760463771499,"Major depressive affective disorder, recurrent episode, severe, without mention of psychotic behavior",0.9780567298600658,lr,180
V8543,-0.022194453192999918,"Body Mass Index 50.0-59.9, adult",0.9780500316074162,lr,180
2858,-0.02227133852591268,Other specified anemias,0.9779748367958568,lr,180
E887,-0.02229826748738373,"Fracture, cause unspecified",0.9779485013037523,lr,180
V1229,-0.022307623260800487,"Personal history of other endocrine, metabolic, and immunity disorders",0.9779393518819609,lr,180
3484,-0.02231437422462706,Compression of brain,0.9779327498710568,lr,180
78930,-0.02232163093005038,"Abdominal or pelvic swelling, mass, or lump, unspecified site",0.977925653326916,lr,180
L308,-0.0223372976884195,Other specified dermatitis,0.9779103325220163,lr,180
2728,-0.022337329936924024,Other disorders of lipoid metabolism,0.9779103009858711,lr,180
73028,-0.022346956396628304,"Unspecified osteomyelitis, other specified sites",0.9779008872170749,lr,180
52800,-0.022349137320162703,"Stomatitis and mucositis, unspecified",0.9778987544923413,lr,180
34680,-0.022383824909073348,"Other forms of migraine, without mention of intractable migraine without mention of status migrainosus",0.9778648341306604,lr,180
E049,-0.022433334480787936,"Nontoxic goiter, unspecified",0.9778164216599781,lr,180
62210,-0.022462033402717328,"Dysplasia of cervix, unspecified",0.9777883597855063,lr,180
2692,-0.022494439473081922,Unspecified vitamin deficiency,0.9777566740205258,lr,180
2252,-0.022514681709348092,Benign neoplasm of cerebral meninges,0.977736882239235,lr,180
36552,-0.02257521735152686,Pseudoexfoliation glaucoma,0.9776776961006404,lr,180
E8810,-0.02258395853646856,Accidental fall from ladder,0.9776691500764366,lr,180
R062,-0.022605203717655453,Wheezing,0.9776483795388401,lr,180
6210,-0.02268598660767878,Polyp of corpus uteri,0.9775694054672341,lr,180
F419,-0.022708864369315455,"Anxiety disorder, unspecified",0.9775470411232166,lr,180
K5090,-0.02272050507387682,"Crohn's disease, unspecified, without complications",0.9775356618531476,lr,180
3330,-0.022730611785802685,Other degenerative diseases of the basal ganglia,0.9775257822317412,lr,180
0310,-0.022744041740585752,Pulmonary diseases due to other mycobacteria,0.9775126541928413,lr,180
6953,-0.02275238561385857,Rosacea,0.9775044979851594,lr,180
V8741,-0.022760966425799112,Personal history of antineoplastic chemotherapy,0.977496110238878,lr,180
36101,-0.022785187167277066,"Recent retinal detachment, partial, with single defect",0.9774724348450151,lr,180
5259,-0.0227951793292431,Unspecified disorder of the teeth and supporting structures,0.9774626678309257,lr,180
6216,-0.022800331896265683,Malposition of uterus,0.9774576314019929,lr,180
G5601,-0.022849384530732042,"Carpal tunnel syndrome, right upper limb",0.9774096857060344,lr,180
04109,-0.022849878750763455,"Streptococcus infection in conditions classified elsewhere and of unspecified site, other streptococcus",0.9774092026507082,lr,180
4262,-0.02285744513717587,Left bundle branch hemiblock,0.9774018072229762,lr,180
6113,-0.022862189471093402,Fat necrosis of breast,0.9773971701134312,lr,180
2400,-0.02288517057188181,"Goiter, specified as simple",0.9773747087086494,lr,180
3670,-0.022892408250044936,Hypermetropia,0.9773676348106622,lr,180
38611,-0.02290549468592582,Benign paroxysmal positional vertigo,0.9773548446354664,lr,180
M1611,-0.02291424148758176,"Unilateral primary osteoarthritis, right hip",0.9773462959438798,lr,180
V4281,-0.02292416373283961,Bone marrow replaced by transplant,0.9773365985223398,lr,180
E079,-0.022926371982533878,"Disorder of thyroid, unspecified",0.9773344403214778,lr,180
41402,-0.02293983377315181,Coronary atherosclerosis of autologous vein bypass graft,0.9773212837384343,lr,180
99604,-0.0229563215446905,Mechanical complication of automatic implantable cardiac defibrillator,0.9773051700212281,lr,180
72664,-0.022976984499528588,Patellar tendinitis,0.9772849762172695,lr,180
1123,-0.02298293748939649,Candidiasis of skin and nails,0.9772791584670245,lr,180
V5873,-0.022987775036730138,"Aftercare following surgery of the circulatory system, NEC",0.9772744308442723,lr,180
25082,-0.022988197696570074,"Diabetes with other specified manifestations, type II or unspecified type, uncontrolled",0.9772740177897051,lr,180
E109,-0.02299726790311088,Type 1 diabetes mellitus without complications,0.9772651537527162,lr,180
G8929,-0.023009345876721637,Other chronic pain,0.9772533504412586,lr,180
Z961,-0.023013612874182552,Presence of intraocular lens,0.9772491805125901,lr,180
B182,-0.023026549424564016,Chronic viral hepatitis C,0.9772365383611042,lr,180
5933,-0.02304767838617228,Stricture or kinking of ureter,0.9772158905859368,lr,180
Z1212,-0.02308110232592076,Encounter for screening for malignant neoplasm of rectum,0.9771832287267357,lr,180
5769,-0.023109041135251217,Unspecified disorder of biliary tract,0.9771559277722073,lr,180
05410,-0.023134744743292756,"Genital herpes, unspecified",0.9771308116620331,lr,180
05319,-0.023142073751918346,Herpes zoster with other nervous system complications,0.977123650288129,lr,180
C44319,-0.02314790284328257,Basal cell carcinoma of skin of other parts of face,0.9771179545616977,lr,180
V659,-0.02317470046373516,Unspecified reason for consultation,0.9770917704764511,lr,180
E8780,-0.023221216361458203,"Surgical operation with transplant of whole organ causing abnormal patient reaction, or later complication, without mention of misadventure at time of operation",0.977046321232654,lr,180
V674,-0.023246370591160703,"Follow-up examination, following treatment of healed fracture",0.977021744694163,lr,180
72992,-0.02325978692751507,Nontraumatic hematoma of soft tissue,0.9770086367297413,lr,180
M4802,-0.023264143691153365,"Spinal stenosis, cervical region",0.9770043801433109,lr,180
N760,-0.023266474789990978,Acute vaginitis,0.9770021026521906,lr,180
41189,-0.02327779349561863,"Other acute and subacute forms of ischemic heart disease, other",0.9769910443155763,lr,180
1809,-0.023286927682448184,"Malignant neoplasm of cervix uteri, unspecified site",0.9769821203376033,lr,180
5128,-0.023314986986899783,Other pneumothorax and air leak,0.9769547072834425,lr,180
1726,-0.023342148050494237,"Malignant melanoma of skin of upper limb, including shoulder",0.9769281725148669,lr,180
V168,-0.023369171268102316,Family history of other specified malignant neoplasm,0.9769017731289733,lr,180
4730,-0.023376105834410008,Chronic maxillary sinusitis,0.9768949987623402,lr,180
L409,-0.023413653101234496,"Psoriasis, unspecified",0.9768583197137655,lr,180
V1551,-0.023461562250497375,Personal history of traumatic fracture,0.9768115203837846,lr,180
2801,-0.02348605233196515,Iron deficiency anemia secondary to inadequate dietary iron intake,0.9767875984829976,lr,180
J209,-0.02351313175190734,"Acute bronchitis, unspecified",0.9767611479995574,lr,180
2764,-0.023527427841262778,Mixed acid-base balance disorder,0.9767471842347205,lr,180
8405,-0.02354875510763031,Subscapularis (muscle) sprain,0.9767263531094849,lr,180
37714,-0.023578600100944,Glaucomatous atrophy [cupping] of optic disc,0.9766972031529993,lr,180
R4189,-0.02358712410721493,Other symptoms and signs involving cognitive functions and awareness,0.9766888778153975,lr,180
R251,-0.023609523622078032,"Tremor, unspecified",0.9766670007033815,lr,180
M533,-0.023617598858451678,"Sacrococcygeal disorders, not elsewhere classified",0.9766591139183364,lr,180
22800,-0.023707588079689187,Hemangioma of unspecified site,0.9765712290796638,lr,180
2410,-0.02374857124113113,Nontoxic uninodular goiter,0.9765312069234456,lr,180
8831,-0.02380310365867786,"Open wound of finger(s), complicated",0.9764779557678926,lr,180
V8521,-0.02384708619869717,"Body Mass Index 25.0-25.9, adult",0.976435008731592,lr,180
7811,-0.023848636218875004,Disturbances of sensation of smell and taste,0.976433495238799,lr,180
71531,-0.023851068947916637,"Osteoarthrosis, localized, not specified whether primary or secondary, shoulder region",0.9764311198435672,lr,180
V7399,-0.023865768893709866,Special screening examination for unspecified viral disease,0.9764167664645319,lr,180
Y92230,-0.02386600511109945,Patient room in hospital as the place of occurrence of the external cause,0.9764165358179394,lr,180
I255,-0.023867305566128965,Ischemic cardiomyopathy,0.9764152660329702,lr,180
6923,-0.023909814556646,Contact dermatitis and other eczema due to drugs and medicines in contact with skin,0.9763737604878714,lr,180
5691,-0.023918824415935284,Rectal prolapse,0.9763649635373054,lr,180
73342,-0.023935952437679358,Aseptic necrosis of head and neck of femur,0.9763482404801965,lr,180
5935,-0.02400619838028658,Hydroureter,0.9762796583865663,lr,180
8920,-0.02407063415671869,"Open wound of foot except toe(s) alone, without mention of complication",0.9762167530754613,lr,180
29383,-0.024070858744770843,Mood disorder in conditions classified elsewhere,0.9762165338288669,lr,180
73399,-0.024095189588737787,Other disorders of bone and cartilage,0.9761927819456572,lr,180
85220,-0.024108567515605066,"Subdural hemorrhage following injury without mention of open intracranial wound, unspecified state of consciousness",0.9761797225973656,lr,180
E8121,-0.024115929774164296,Other motor vehicle traffic accident involving collision with motor vehicle injuring passenger in motor vehicle other than motorcycle,0.9761725357363034,lr,180
