feature,weight,feature_desc,odds_ratio,model,cutoff
Z780,-0.009214259058721743,Asymptomatic menopausal state,0.9908280621403657,lr,270
F1020,-0.009232988012002355,"Alcohol dependence, uncomplicated",0.9908095051416579,lr,270
29636,-0.00925155856246612,"Major depressive affective disorder, recurrent episode, in full remission",0.9907911054345895,lr,270
F0280,-0.009257536164097056,Dementia in other diseases classified elsewhere without behavioral disturbance,0.9907851828977631,lr,270
4532,-0.009272965399485461,Other venous embolism and thrombosis of inferior vena cava,0.99076989595789,lr,270
E11351,-0.009277097805370895,Type 2 diabetes mellitus with proliferative diabetic retinopathy with macular edema,0.9907658017030004,lr,270
R7303,-0.0092814248079496,Prediabetes,0.9907615146660965,lr,270
1913,-0.009296755179963045,Malignant neoplasm of parietal lobe,0.9907463260399241,lr,270
71230,-0.009301122573071386,"Chondrocalcinosis, unspecified, site unspecified",0.9907419990706964,lr,270
Z122,-0.009301286504120822,Encounter for screening for malignant neoplasm of respiratory organs,0.9907418366573341,lr,270
K429,-0.009307326122119467,Umbilical hernia without obstruction or gangrene,0.990735852973175,lr,270
45111,-0.009311778201457586,Phlebitis and thrombophlebitis of femoral vein (deep) (superficial),0.9907314421483732,lr,270
79311,-0.009328019893380352,Solitary pulmonary nodule,0.9907153511241846,lr,270
D801,-0.00933738319397269,Nonfamilial hypogammaglobulinemia,0.9907060748019791,lr,270
D6959,-0.009341863591569164,Other secondary thrombocytopenia,0.9907016360548065,lr,270
1912,-0.009344820110718863,Malignant neoplasm of temporal lobe,0.9906987070307778,lr,270
N6019,-0.009354526501411288,Diffuse cystic mastopathy of unspecified breast,0.9906890909687375,lr,270
Z4889,-0.009364710224337207,Encounter for other specified surgical aftercare,0.9906790021169005,lr,270
71511,-0.009399172135448126,"Osteoarthrosis, localized, primary, shoulder region",0.99064486201346,lr,270
M25522,-0.009402471278263382,Pain in left elbow,0.9906415937399723,lr,270
11284,-0.009408572738527339,Candidal esophagitis,0.990635549398092,lr,270
V1085,-0.009433059498881213,Personal history of malignant neoplasm of brain,0.9906112922397866,lr,270
2392,-0.009442555448230621,"Neoplasm of unspecified nature of bone, soft tissue, and skin",0.9906018854897937,lr,270
Z86000,-0.009458341179108952,Personal history of in-situ neoplasm of breast,0.9905862482384448,lr,270
R222,-0.009459978631207653,"Localized swelling, mass and lump, trunk",0.9905846262022417,lr,270
2682,-0.009468592143237373,"Osteomalacia, unspecified",0.9905760938263943,lr,270
N181,-0.009468720707782154,"Chronic kidney disease, stage 1",0.9905759664734379,lr,270
V160,-0.009487154062712484,Family history of malignant neoplasm of gastrointestinal tract,0.9905577070033547,lr,270
99674,-0.00951943807208982,"Other complications due to other vascular device, implant, and graft",0.9905257283452554,lr,270
Z87440,-0.009522516074746088,Personal history of urinary (tract) infections,0.9905226795091246,lr,270
K5660,-0.009523898193893567,Unspecified intestinal obstruction,0.9905213104897094,lr,270
M064,-0.009537389564917271,Inflammatory polyarthropathy,0.9905079470893481,lr,270
I6529,-0.0095391351692895,Occlusion and stenosis of unspecified carotid artery,0.990506218055854,lr,270
F4320,-0.00955751144442505,"Adjustment disorder, unspecified",0.9904880164083074,lr,270
34591,-0.009566727764544921,"Epilepsy, unspecified, with intractable epilepsy",0.9904788877957394,lr,270
27402,-0.009570201020874344,Chronic gouty arthropathy without mention of tophus (tophi),0.9904754476146476,lr,270
99642,-0.009585757135529789,Dislocation of prosthetic joint,0.9904600397848643,lr,270
70722,-0.009586119204673636,"Pressure ulcer, stage II",0.9904596811699107,lr,270
22809,-0.009602529212905818,Hemangioma of other sites,0.9904434278517479,lr,270
J9601,-0.009606010937109746,Acute respiratory failure with hypoxia,0.9904399794068958,lr,270
Y831,-0.009622246701298388,"Surgical operation with implant of artificial internal device as the cause of abnormal reaction of the patient, or of later complication, without mention of misadventure at the time of the procedure",0.9904238989874865,lr,270
81352,-0.0096309695895031,Other open fractures of distal end of radius (alone),0.9904152596682203,lr,270
4785,-0.009638583397542401,Other diseases of vocal cords,0.9904077188652611,lr,270
3108,-0.009640833349515474,Other specified nonpsychotic mental disorders following organic brain damage,0.9904054904979668,lr,270
D61818,-0.009642787202335325,Other pancytopenia,0.9904035553932968,lr,270
G4710,-0.009643224736323687,"Hypersomnia, unspecified",0.9904031220581739,lr,270
C44729,-0.009651266880587752,"Squamous cell carcinoma of skin of left lower limb, including hip",0.9903951571254144,lr,270
72767,-0.00966409010197443,Nontraumatic rupture of achilles tendon,0.9903824571504818,lr,270
3453,-0.009665813245751765,Grand mal status,0.9903807505805838,lr,270
J4520,-0.009669349028220392,"Mild intermittent asthma, uncomplicated",0.9903772488158794,lr,270
9972,-0.009673348079731142,"Peripheral vascular complications, not elsewhere classified",0.9903732882541656,lr,270
N201,-0.009684751406782299,Calculus of ureter,0.9903619947680486,lr,270
M79673,-0.00968770744736122,Pain in unspecified foot,0.9903590672221313,lr,270
30590,-0.009693252774219618,"Other, mixed, or unspecified drug abuse, unspecified",0.9903535753726235,lr,270
E915,-0.00969815683573004,Foreign body accidentally entering other orifice,0.9903487186296817,lr,270
I5042,-0.009699722955880211,Chronic combined systolic (congestive) and diastolic (congestive) heart failure,0.9903471676258122,lr,270
71236,-0.009706013393033988,"Chondrocalcinosis, unspecified, lower leg",0.9903409379287876,lr,270
V059,-0.009731295685856702,Need for prophylactic vaccination and inoculation against unspecified single disease,0.990315900155708,lr,270
0782,-0.009753400124561674,Sweating fever,0.99029401002053,lr,270
4784,-0.009763206886627957,Polyp of vocal cord or larynx,0.9902842984904174,lr,270
20150,-0.009780972945462157,"Hodgkin's disease, nodular sclerosis, unspecified site, extranodal and solid organ sites",0.9902667051975901,lr,270
Z8505,-0.00978148462883715,Personal history of malignant neoplasm of liver,0.9902661984947099,lr,270
M19071,-0.009786500895311082,"Primary osteoarthritis, right ankle and foot",0.9902612310680371,lr,270
I491,-0.009800434192733111,Atrial premature depolarization,0.9902474335599017,lr,270
40311,-0.00980290520252096,"Hypertensive chronic kidney disease, benign, with chronic kidney disease stage V or end stage renal disease",0.9902449866518241,lr,270
C8580,-0.009837761573945574,"Other specified types of non-Hodgkin lymphoma, unspecified site",0.9902104709063184,lr,270
43885,-0.009846769550332443,"Other late effects of cerebrovascular disease, vertigo",0.9902015511539529,lr,270
I130,-0.009857541422674915,"Hypertensive heart and chronic kidney disease with heart failure and stage 1 through stage 4 chronic kidney disease, or unspecified chronic kidney disease",0.9901908848866986,lr,270
H3531,-0.009859903365888914,Nonexudative age-related macular degeneration,0.9901885461148194,lr,270
N19,-0.009863255155610163,Unspecified kidney failure,0.9901852272165906,lr,270
5692,-0.00986998610167167,Stenosis of rectum and anus,0.9901785623556657,lr,270
C44320,-0.009872974158232187,Squamous cell carcinoma of skin of unspecified parts of face,0.9901756036505368,lr,270
1965,-0.009877902057633583,Secondary and unspecified malignant neoplasm of lymph nodes of inguinal region and lower limb,0.9901707241767951,lr,270
K5732,-0.00987949785117681,Diverticulitis of large intestine without perforation or abscess without bleeding,0.9901691440700076,lr,270
59651,-0.009884331777718275,Hypertonicity of bladder,0.99016435767667,lr,270
D352,-0.009889822031858727,Benign neoplasm of pituitary gland,0.9901589214376287,lr,270
1888,-0.009911909370742322,Malignant neoplasm of other specified sites of bladder,0.9901370517035053,lr,270
3099,-0.009917703705536437,Unspecified adjustment reaction,0.9901313145345573,lr,270
M7061,-0.009935927557764738,"Trochanteric bursitis, right hip",0.9901132706922092,lr,270
5362,-0.009942237970481521,Persistent vomiting,0.9901070226885486,lr,270
4478,-0.009947323056844018,Other specified disorders of arteries and arterioles,0.9901019879216312,lr,270
L0390,-0.009968348392625552,"Cellulitis, unspecified",0.9900811709137202,lr,270
V452,-0.009968495044276294,Presence of cerebrospinal fluid drainage device,0.9900810257166928,lr,270
47870,-0.009984294853982608,Unspecified disease of larynx,0.9900653827484709,lr,270
R0982,-0.00999210461274179,Postnasal drip,0.9900576506068689,lr,270
4464,-0.009994031947398131,Wegener's granulomatosis,0.990055742436286,lr,270
D45,-0.010002936929118838,Polycythemia vera,0.9900469260472521,lr,270
64233,-0.010005016452258883,"Transient hypertension of pregnancy, antepartum condition or complication",0.9900448672239003,lr,270
E8342,-0.01000538727267511,Other fall from one level to another in water transport injuring occupant of other watercraft -- crew,0.9900445000951187,lr,270
72281,-0.010038957719695218,"Postlaminectomy syndrome, cervical region",0.9900112644165521,lr,270
I441,-0.01004907015086531,"Atrioventricular block, second degree",0.9900012530464027,lr,270
20283,-0.010059416473966099,"Other malignant lymphomas, intra-abdominal lymph nodes",0.9899910102265564,lr,270
Y848,-0.010082071877521234,"Other medical procedures as the cause of abnormal reaction of the patient, or of later complication, without mention of misadventure at the time of the procedure",0.9899685818347669,lr,270
28803,-0.010088375868644434,Drug induced neutropenia,0.9899623411012856,lr,270
R0981,-0.010098704186266268,Nasal congestion,0.9899521165085945,lr,270
20501,-0.01009941408346965,"Acute myeloid leukemia, in remission",0.9899514137446049,lr,270
I69398,-0.010108596764452927,Other sequelae of cerebral infarction,0.9899423233783206,lr,270
Y9289,-0.010125604899952486,Other specified places as the place of occurrence of the external cause,0.9899254864483307,lr,270
99644,-0.010131298060202652,Peri-prosthetic fracture around prosthetic joint,0.9899198506599433,lr,270
82123,-0.010134854241583932,Closed supracondylar fracture of femur,0.9899163303316609,lr,270
1508,-0.010159920766989489,Malignant neoplasm of other specified part of esophagus,0.989891516879812,lr,270
78724,-0.010161423604247018,"Dysphagia, pharyngoesophageal phase",0.9898900292350774,lr,270
7271,-0.010168061810450697,Bunion,0.9898834581627545,lr,270
L089,-0.010197591095899147,"Local infection of the skin and subcutaneous tissue, unspecified",0.9898542280431321,lr,270
70712,-0.010198955366524334,Ulcer of calf,0.9898528776150067,lr,270
34540,-0.010203750892736793,"Localization-related (focal) (partial) epilepsy and epileptic syndromes with complex partial seizures, without mention of intractable epilepsy",0.9898481307609674,lr,270
E46,-0.010206583023852784,Unspecified protein-calorie malnutrition,0.989845327385246,lr,270
M419,-0.010216036817258719,"Scoliosis, unspecified",0.9898359696362503,lr,270
J3489,-0.010219654702112564,Other specified disorders of nose and nasal sinuses,0.989832388530166,lr,270
62133,-0.010222744736105223,Endometrial hyperplasia with atypia,0.989829329919164,lr,270
Z9114,-0.010225335229169314,Patient's other noncompliance with medication regimen,0.9898267657764714,lr,270
78821,-0.01023275053642746,Incomplete bladder emptying,0.9898194259340845,lr,270
2535,-0.010235205469649226,Diabetes insipidus,0.9898169959964749,lr,270
M62838,-0.010243472250074284,Other muscle spasm,0.9898088134305297,lr,270
J849,-0.010276506524378943,"Interstitial pulmonary disease, unspecified",0.9897761163547427,lr,270
N8320,-0.010296918774122804,Unspecified ovarian cysts,0.9897559130036638,lr,270
Z8679,-0.010314799095803984,Personal history of other diseases of the circulatory system,0.9897382160077679,lr,270
H539,-0.01031779439205968,Unspecified visual disturbance,0.9897352514530353,lr,270
99685,-0.010318263344662161,Complications of transplanted bone marrow,0.9897347873142222,lr,270
M79644,-0.010331215904135105,Pain in right finger(s),0.98972196779855,lr,270
E8849,-0.010351439693086963,Other accidental fall from one level to another,0.9897019520727498,lr,270
F330,-0.01035750732592122,"Major depressive disorder, recurrent, mild",0.9896959469429077,lr,270
36616,-0.010366098774992658,Senile nuclear sclerosis,0.9896874440571095,lr,270
V4976,-0.010368858868172723,Above knee amputation status,0.9896847124313145,lr,270
29634,-0.010386362512119652,"Major depressive affective disorder, recurrent episode, severe, specified as with psychotic behavior",0.9896673894940962,lr,270
R040,-0.010404525539139559,Epistaxis,0.9896494143018024,lr,270
73314,-0.010414986379266276,Pathologic fracture of neck of femur,0.9896390617916461,lr,270
G9340,-0.010429274905117598,"Encephalopathy, unspecified",0.989624921409351,lr,270
71952,-0.01043267431425473,"Stiffness of joint, not elsewhere classified, upper arm",0.9896215572750688,lr,270
1869,-0.010435968445790903,Malignant neoplasm of other and unspecified testis,0.9896182973368575,lr,270
D239,-0.010452726311217807,"Other benign neoplasm of skin, unspecified",0.9896017135855613,lr,270
2362,-0.01045706679452217,Neoplasm of uncertain behavior of ovary,0.9895974182451674,lr,270
17362,-0.01047279745999181,"Squamous cell carcinoma of skin of upper limb, including shoulder",0.9895818513416705,lr,270
R072,-0.010475651552633924,Precordial pain,0.9895790269874204,lr,270
Z9049,-0.010482335883501762,Acquired absence of other specified parts of digestive tract,0.9895724123358914,lr,270
4409,-0.010491175019638282,Generalized and unspecified atherosclerosis,0.9895636654092795,lr,270
M25461,-0.010492567620682744,"Effusion, right knee",0.989562287342845,lr,270
81343,-0.010494861759456962,Closed fracture of distal end of ulna (alone),0.9895600171522362,lr,270
2529,-0.01049559981050277,Unspecified disorder of parathyroid gland,0.9895592868067001,lr,270
G5600,-0.010499158898159276,"Carpal tunnel syndrome, unspecified upper limb",0.9895557648847245,lr,270
61800,-0.010510154030495626,Unspecified prolapse of vaginal walls,0.9895448846479503,lr,270
I420,-0.010559162731274148,Dilated cardiomyopathy,0.9894963895271429,lr,270
8832,-0.01056227275221036,"Open wound of finger(s), with tendon involvement",0.9894933121774404,lr,270
M25462,-0.010574362971928887,"Effusion, left knee",0.9894813490582047,lr,270
V1351,-0.010576227618901486,Personal history of pathologic fracture,0.989479504026523,lr,270
28241,-0.010588086412005083,Sickle-cell thalassemia without crisis,0.9894677700633799,lr,270
J4530,-0.010591514303194388,"Mild persistent asthma, uncomplicated",0.9894643782813421,lr,270
M2040,-0.010592088006776981,"Other hammer toe(s) (acquired), unspecified foot",0.9894638106222463,lr,270
7282,-0.010592427494521406,"Muscular wasting and disuse atrophy, not elsewhere classified",0.989463474711466,lr,270
7877,-0.010592845358141931,Abnormal feces,0.9894630612507626,lr,270
2564,-0.010594697712607307,Polycystic ovaries,0.9894612284161403,lr,270
H6120,-0.010600584040318214,"Impacted cerumen, unspecified ear",0.9894554041402344,lr,270
99641,-0.010610185247997476,Mechanical loosening of prosthetic joint,0.9894459042190152,lr,270
6185,-0.010617676409272442,Prolapse of vaginal vault after hysterectomy,0.9894384921479364,lr,270
R221,-0.010634399628728856,"Localized swelling, mass and lump, neck",0.989421945689249,lr,270
81403,-0.01064936310137579,Closed fracture of triquetral [cuneiform] bone of wrist,0.9894071406117964,lr,270
M7542,-0.010659755001303478,Impingement syndrome of left shoulder,0.9893968588452271,lr,270
M25521,-0.010667634571219364,Pain in right elbow,0.9893890628542178,lr,270
R296,-0.010668930224041457,Repeated falls,0.9893877809503168,lr,270
36816,-0.010708679716946192,Psychophysical visual disturbances,0.9893484540693549,lr,270
M75101,-0.010719058320004788,"Unspecified rotator cuff tear or rupture of right shoulder, not specified as traumatic",0.9893381860677473,lr,270
K743,-0.010722160914374983,Primary biliary cirrhosis,0.9893351165574227,lr,270
5568,-0.01073662698412138,Other ulcerative colitis,0.9893208048701412,lr,270
4512,-0.010744143313938668,"Phlebitis and thrombophlebitis of lower extremities, unspecified",0.9893133688366226,lr,270
17322,-0.010748699429888495,Squamous cell carcinoma of skin of ear and external auditory canal,0.9893088614204716,lr,270
8921,-0.010762001902666728,"Open wound of foot except toe(s) alone, complicated",0.9892957012538048,lr,270
53642,-0.010768468439586652,Mechanical complication of gastrostomy,0.9892893039573122,lr,270
C20,-0.010769053761203315,Malignant neoplasm of rectum,0.9892887249050669,lr,270
71995,-0.010784677336916074,"Unspecified disorder of joint, pelvic region and thigh",0.9892732687985117,lr,270
I4940,-0.010791567167468038,Unspecified premature depolarization,0.9892664528968004,lr,270
7824,-0.01079304047685312,"Jaundice, unspecified, not of newborn",0.9892649954023246,lr,270
H2511,-0.010813676573512827,"Age-related nuclear cataract, right eye",0.9892445810448944,lr,270
73008,-0.010814681262476667,"Acute osteomyelitis, other specified sites",0.9892435871622807,lr,270
M9973,-0.010819992273381443,Connective tissue and disc stenosis of intervertebral foramina of lumbar region,0.9892383332927535,lr,270
5951,-0.010820075328321561,Chronic interstitial cystitis,0.9892382511316263,lr,270
1713,-0.01083464720494781,"Malignant neoplasm of connective and other soft tissue of lower limb, including hip",0.9892238361789035,lr,270
Q211,-0.010844910574573347,Atrial septal defect,0.9892136834611311,lr,270
M2240,-0.01085571286971699,"Chondromalacia patellae, unspecified knee",0.9892029977406774,lr,270
43491,-0.010895089075317008,"Cerebral artery occlusion, unspecified with cerebral infarction",0.9891640474469207,lr,270
80701,-0.010903750221658055,Closed fracture of one rib,0.9891554801894517,lr,270
E11359,-0.010904653379947171,Type 2 diabetes mellitus with proliferative diabetic retinopathy without macular edema,0.989154586825884,lr,270
I319,-0.010916087613753192,"Disease of pericardium, unspecified",0.9891432766657295,lr,270
G4731,-0.010918578825877089,Primary central sleep apnea,0.9891408125030757,lr,270
7820,-0.010973530680383765,Disturbance of skin sensation,0.9890864588744905,lr,270
Z716,-0.01097587762226496,Tobacco abuse counseling,0.9890841375487801,lr,270
L03116,-0.010981798592861037,Cellulitis of left lower limb,0.9890782812280221,lr,270
70723,-0.010996388921135605,"Pressure ulcer, stage III",0.9890638503564856,lr,270
E9288,-0.011022911448153762,Other accidents,0.9890376182316645,lr,270
V8531,-0.011026671538666282,"Body Mass Index 31.0-31.9, adult",0.9890338993676914,lr,270
6179,-0.011038606178038275,"Endometriosis, site unspecified",0.9890220956752123,lr,270
R1012,-0.011048551561979269,Left upper quadrant pain,0.9890122595196569,lr,270
45621,-0.011080337818875324,"Esophageal varices in diseases classified elsewhere, without mention of bleeding",0.9889808230215293,lr,270
82120,-0.011092783999650142,"Closed fracture of lower end of femur, unspecified part",0.9889685140640231,lr,270
H6123,-0.011100340673530277,"Impacted cerumen, bilateral",0.9889610407797212,lr,270
G4721,-0.011117536039943693,"Circadian rhythm sleep disorder, delayed sleep phase type",0.988944035378464,lr,270
V1649,-0.011118154155850313,Family history of malignant neoplasm of other genital organs,0.9889434240966138,lr,270
Y832,-0.011162233330345342,"Surgical operation with anastomosis, bypass or graft as the cause of abnormal reaction of the patient, or of later complication, without mention of misadventure at the time of the procedure",0.9888998332475888,lr,270
Z853,-0.011162465742365657,Personal history of malignant neoplasm of breast,0.9888996034154073,lr,270
V1081,-0.0111830821403809,Personal history of malignant neoplasm of bone,0.9888792160777437,lr,270
Z944,-0.011183223044350158,Liver transplant status,0.9888790767407468,lr,270
2534,-0.01119248092671006,Other anterior pituitary disorders,0.9888699218569637,lr,270
25072,-0.011194437951987754,"Diabetes with peripheral circulatory disorders, type II or unspecified type, uncontrolled",0.9888679866154239,lr,270
28419,-0.011207666425302926,Other pancytopenia,0.9888549054881726,lr,270
27651,-0.011213508840691732,Dehydration,0.9888491282039321,lr,270
64403,-0.011217641751054018,"Threatened premature labor, antepartum condition or complication",0.9888450413875687,lr,270
M2011,-0.011231608922173024,"Hallux valgus (acquired), right foot",0.9888312301161178,lr,270
28749,-0.011262431316086908,Other secondary thrombocytopenia,0.9888007524401288,lr,270
17321,-0.011265539999913393,Basal cell carcinoma of skin of ear and external auditory canal,0.9887976785759999,lr,270
5282,-0.01128235561707805,Oral aphthae,0.9887810514725814,lr,270
5821,-0.011298414557715407,Chronic glomerulonephritis with lesion of membranous glomerulonephritis,0.98876517282387,lr,270
7580,-0.011324510129594748,Down's syndrome,0.988739370767892,lr,270
E83110,-0.011333583678209302,Hereditary hemochromatosis,0.9887303994338452,lr,270
V4361,-0.01136276965958053,Shoulder joint replacement,0.988701542787933,lr,270
N1330,-0.011366191203798415,Unspecified hydronephrosis,0.9886981599076734,lr,270
C779,-0.011382307762940878,"Secondary and unspecified malignant neoplasm of lymph node, unspecified",0.9886822256237084,lr,270
Z01411,-0.011385562640890716,Encounter for gynecological examination (general) (routine) with abnormal findings,0.98867900758897,lr,270
99661,-0.011386124654858311,"Infection and inflammatory reaction due to cardiac device, implant, and graft",0.9886784519377144,lr,270
49120,-0.011388834291295124,Obstructive chronic bronchitis without exacerbation,0.9886757729821862,lr,270
496,-0.011390569349344895,"Chronic airway obstruction, not elsewhere classified",0.9886740575738159,lr,270
43884,-0.011399507044551218,"Other late effects of cerebrovascular disease, ataxia",0.9886652211459196,lr,270
D235,-0.011402179354871925,Other benign neoplasm of skin of trunk,0.9886625791291755,lr,270
7469,-0.011406075197895441,Unspecified congenital anomaly of heart,0.9886587274624667,lr,270
M79645,-0.011439908690645276,Pain in left finger(s),0.9886252782504341,lr,270
L723,-0.011454539616118243,Sebaceous cyst,0.9886108138534814,lr,270
B9620,-0.01147268991711226,Unspecified Escherichia coli [E. coli] as the cause of diseases classified elsewhere,0.9885928704324838,lr,270
R161,-0.011496379026197835,"Splenomegaly, not elsewhere classified",0.9885694518255189,lr,270
138,-0.011510955863177692,Late effects of acute poliomyelitis,0.9885550417148036,lr,270
64093,-0.011511994135208554,"Unspecified hemorrhage in early pregnancy, antepartum condition or complication",0.9885540153262856,lr,270
71650,-0.011524241933254463,"Unspecified polyarthropathy or polyarthritis, site unspecified",0.9885419077904939,lr,270
3419,-0.011529662117193246,"Demyelinating disease of central nervous system, unspecified",0.9885365497260433,lr,270
B9681,-0.011535265099453029,Helicobacter pylori [H. pylori] as the cause of diseases classified elsewhere,0.9885310109888088,lr,270
07044,-0.011535806166217353,Chronic hepatitis C with hepatic coma,0.988530476127678,lr,270
3570,-0.011538025330642842,Acute infective polyneuritis,0.9885282824184459,lr,270
Z905,-0.011543803711354413,Acquired absence of kidney,0.9885225703421893,lr,270
71617,-0.011549836825397728,"Traumatic arthropathy, ankle and foot",0.9885166064907783,lr,270
2967,-0.011550124057123773,"Bipolar I disorder, most recent episode (or current) unspecified",0.988516322557488,lr,270
I6521,-0.011555931861887728,Occlusion and stenosis of right carotid artery,0.9885105814643522,lr,270
H8110,-0.0115617339148772,"Benign paroxysmal vertigo, unspecified ear",0.9885048460902164,lr,270
8600,-0.011571918417637023,Traumatic pneumothorax without mention of open wound into thorax,0.988494778711149,lr,270
E781,-0.011572584661366177,Pure hyperglyceridemia,0.9884941201329207,lr,270
M7541,-0.011577105406379573,Impingement syndrome of right shoulder,0.9884896514131574,lr,270
30741,-0.011589222717547504,Transient disorder of initiating or maintaining sleep,0.9884776736490342,lr,270
R61,-0.011598267007398685,Generalized hyperhidrosis,0.9884687336108705,lr,270
3370,-0.011609136886859639,Idiopathic peripheral autonomic neuropathy,0.9884579891332809,lr,270
71666,-0.011609780399639648,"Unspecified monoarthritis, lower leg",0.9884573530481371,lr,270
2825,-0.011628496467316413,Sickle-cell trait,0.9884388531865447,lr,270
M189,-0.011632375156781742,"Osteoarthritis of first carpometacarpal joint, unspecified",0.9884350193466128,lr,270
E789,-0.011633203718854871,"Disorder of lipoprotein metabolism, unspecified",0.9884342003671833,lr,270
L03115,-0.011636400438830637,Cellulitis of right lower limb,0.9884310406248807,lr,270
4267,-0.011675558303582384,Anomalous atrioventricular excitation,0.9883923365336652,lr,270
3591,-0.011685422405933179,Hereditary progressive muscular dystrophy,0.9883825869785803,lr,270
C4441,-0.011702153591919184,Basal cell carcinoma of skin of scalp and neck,0.9883660503040317,lr,270
K641,-0.011709256093933123,Second degree hemorrhoids,0.9883590304570982,lr,270
M62830,-0.011710910223136318,Muscle spasm of back,0.9883573955849149,lr,270
4481,-0.01171202705755249,"Nevus, non-neoplastic",0.9883562917539763,lr,270
R490,-0.011721637506997933,Dysphonia,0.9883467932514429,lr,270
C44329,-0.011722736049803046,Squamous cell carcinoma of skin of other parts of face,0.9883457075107805,lr,270
9243,-0.011732292592460229,Contusion of toe,0.9883362623879981,lr,270
K259,-0.01178873261966188,"Gastric ulcer, unspecified as acute or chronic, without hemorrhage or perforation",0.988280482236596,lr,270
R0609,-0.01180329216901089,Other forms of dyspnea,0.9882660934228918,lr,270
