feature,weight,feature_desc,odds_ratio,model,cutoff
R0789,-0.0187704491768221,Other chest pain,0.9814046186259989,lr,270
V122,-0.018773364088930638,"Endocrine, metabolic, and immunity disorders",0.9814017579219622,lr,270
1982,-0.018780723982130997,Secondary malignant neoplasm of skin,0.9813945349364174,lr,270
K7030,-0.01881730578490989,Alcoholic cirrhosis of liver without ascites,0.9813586344117491,lr,270
44389,-0.018848128774120846,Other specified peripheral vascular diseases,0.9813283864713168,lr,270
J479,-0.018877677289094463,"Bronchiectasis, uncomplicated",0.9812993901031971,lr,270
04102,-0.018879583298381984,"Streptococcus infection in conditions classified elsewhere and of unspecified site, streptococcus, group B",0.9812975197392282,lr,270
8088,-0.018894796706054096,Closed unspecified fracture of pelvis,0.9812825909735717,lr,270
65971,-0.01892178748366376,"Abnormality in fetal heart rate or rhythm, delivered, with or without mention of antepartum condition",0.9812561057508166,lr,270
60091,-0.01892633815245602,"Hyperplasia of prostate, unspecified, with urinary obstruction and other lower urinary symptoms (LUTS)",0.981251640389439,lr,270
2252,-0.01892981847358504,Benign neoplasm of cerebral meninges,0.9812482253245649,lr,270
7358,-0.018931787897787006,Other acquired deformities of toe,0.9812462928324648,lr,270
64683,-0.018942925405788583,"Other specified complications of pregnancy, antepartum condition or complication",0.9812353642548854,lr,270
3368,-0.01894733664700117,Other myelopathy,0.9812310357985544,lr,270
V4975,-0.018954698887407348,Below knee amputation status,0.9812238117663674,lr,270
H9190,-0.01896811650949141,"Unspecified hearing loss, unspecified ear",0.981210646164407,lr,270
2305,-0.018984519929591118,Carcinoma in situ of anal canal,0.9811945510859792,lr,270
07054,-0.018994688848717866,Chronic hepatitis C without mention of hepatic coma,0.9811845734486725,lr,270
K900,-0.019001104218999528,Celiac disease,0.9811782788065104,lr,270
E9426,-0.01901361135391534,Other antihypertensive agents causing adverse effects in therapeutic use,0.9811660071541427,lr,270
V6889,-0.019032177080447923,Encounters for other specified administrative purpose,0.981147791263467,lr,270
N644,-0.01903296166467251,Mastodynia,0.98114702147069,lr,270
37621,-0.01903642436658718,Thyrotoxic exophthalmos,0.9811436240569023,lr,270
1918,-0.019042395117918234,Malignant neoplasm of other parts of brain,0.9811377659097917,lr,270
V4972,-0.019066886260819347,Other toe(s) amputation status,0.9811137370188099,lr,270
7048,-0.01906804668668067,Other specified diseases of hair and hair follicles,0.9811125985097171,lr,270
64511,-0.019083023205882687,"Post term pregnancy, delivered, with or without mention of antepartum condition",0.9810979049680755,lr,270
7992,-0.019084690411533475,Signs and symptoms involving emotional state,0.9810962692774678,lr,270
C44319,-0.019125532567555215,Basal cell carcinoma of skin of other parts of face,0.981056200008829,lr,270
36846,-0.019130910026152997,Homonymous bilateral field defects,0.981050924433916,lr,270
Z5189,-0.019138881345436665,Encounter for other specified aftercare,0.9810431041949326,lr,270
M533,-0.01913900030856298,"Sacrococcygeal disorders, not elsewhere classified",0.9810429874869848,lr,270
Z66,-0.019140884035391135,Do not resuscitate,0.9810411394717302,lr,270
47831,-0.01915554182322062,"Unilateral paralysis of vocal cords or larynx, partial",0.981026759684244,lr,270
60889,-0.019174301913679727,Other specified disorders of male genital organs,0.9810083557061203,lr,270
V641,-0.01918441456357139,Surgical or other procedure not carried out because of contraindication,0.9809984351622398,lr,270
Z452,-0.019190580498378983,Encounter for adjustment and management of vascular access device,0.9809923864084904,lr,270
I25119,-0.019194865445347417,Atherosclerotic heart disease of native coronary artery with unspecified angina pectoris,0.9809881829171441,lr,270
7018,-0.01919815462871435,Other specified hypertrophic and atrophic conditions of skin,0.9809849562724362,lr,270
37210,-0.019206070746866536,"Chronic conjunctivitis, unspecified",0.9809771907103534,lr,270
V1551,-0.01921408125130253,Personal history of traumatic fracture,0.9809693326196892,lr,270
R4189,-0.019229658818548847,Other symptoms and signs involving cognitive functions and awareness,0.9809540516229645,lr,270
87342,-0.01923007877393892,"Open wound of forehead, without mention of complication",0.9809536396661096,lr,270
42841,-0.01924511662216486,Acute combined systolic and diastolic heart failure,0.9809388883450739,lr,270
G5601,-0.019265529639477884,"Carpal tunnel syndrome, right upper limb",0.9809188646269361,lr,270
E8888,-0.019266267438452084,Other fall,0.9809181409062709,lr,270
H538,-0.01926841736986775,Other visual disturbances,0.9809160320018107,lr,270
V064,-0.019272560613606382,Need for prophylactic vaccination and inoculation against measles-mumps-rubella (MMR),0.9809119678360224,lr,270
1911,-0.01928620491070775,Malignant neoplasm of frontal lobe,0.9808985840730091,lr,270
70400,-0.019301046593198232,"Alopecia, unspecified",0.9808840259957025,lr,270
C541,-0.019320110009629934,Malignant neoplasm of endometrium,0.9808653271732759,lr,270
2152,-0.01934270197144081,"Other benign neoplasm of connective and other soft tissue of upper limb, including shoulder",0.9808431677515762,lr,270
R062,-0.019347436928496647,Wheezing,0.9808385235122935,lr,270
M4802,-0.01934941356019149,"Spinal stenosis, cervical region",0.9808365847576965,lr,270
Y92009,-0.01935345874811421,Unspecified place in unspecified non-institutional (private) residence as the place of occurrence of the external cause,0.9808326170974146,lr,270
30923,-0.019368003999350847,Specific academic or work inhibition,0.980818350744332,lr,270
K2270,-0.019373671738654487,Barrett's esophagus without dysplasia,0.9808127917373692,lr,270
5728,-0.019401237887136488,Other sequelae of chronic liver disease,0.9807857548789719,lr,270
I255,-0.01940842194674735,Ischemic cardiomyopathy,0.9807787088809529,lr,270
Z953,-0.019444041264849134,Presence of xenogenic heart valve,0.9807437748343009,lr,270
4400,-0.019460974892369386,Atherosclerosis of aorta,0.9807271674251373,lr,270
29281,-0.01949030266537508,Drug-induced delirium,0.9806984053031571,lr,270
29689,-0.019493465661093484,Other bipolar disorders,0.9806953033632058,lr,270
36570,-0.019514247545294527,"Glaucoma stage, unspecified",0.9806749228787479,lr,270
Z1379,-0.01953626779019195,Encounter for other screening for genetic and chromosomal anomalies,0.98065332841454,lr,270
51630,-0.019581285549960248,"Idiopathic interstitial pneumonia, not otherwise specified",0.9806091825922659,lr,270
1123,-0.01959099448089214,Candidiasis of skin and nails,0.9805996619716585,lr,270
2930,-0.01959221312042364,Delirium due to conditions classified elsewhere,0.980598466974874,lr,270
2180,-0.019603287404103092,Submucous leiomyoma of uterus,0.980587607609405,lr,270
Z961,-0.01961558738271203,Presence of intraocular lens,0.9805755464769832,lr,270
K5090,-0.019624618154282583,"Crohn's disease, unspecified, without complications",0.9805666911632006,lr,270
7946,-0.019652327656604417,Nonspecific abnormal results of other endocrine function study,0.9805395205246392,lr,270
2725,-0.01966579050330786,Lipoprotein deficiencies,0.9805263197602478,lr,270
E8859,-0.019678691827422413,"Fall from other slipping, tripping, or stumbling",0.9805136697539949,lr,270
82381,-0.01968018775274676,Closed fracture of unspecified part of fibula alone,0.9805122029798625,lr,270
0340,-0.019690687470411534,Streptococcal sore throat,0.980501907932612,lr,270
V829,-0.019693653405917087,Screening for unspecified condition,0.9804989998315027,lr,270
92411,-0.019718227224713232,Contusion of knee,0.9804749055227968,lr,270
G250,-0.019726522725973562,Essential tremor,0.9804667720257181,lr,270
75611,-0.01974541083020814,"Spondylolysis, lumbosacral region",0.9804482530420243,lr,270
53290,-0.019745982789179533,"Duodenal ulcer, unspecified as acute or chronic, without hemorrhage or perforation, without mention of obstruction",0.9804476922660104,lr,270
V0251,-0.019749499118162102,Carrier or suspected carrier of group B streptococcus,0.9804442446954356,lr,270
2723,-0.01975532223766964,Hyperchylomicronemia,0.9804385354680509,lr,270
J209,-0.0197982792555556,"Acute bronchitis, unspecified",0.9803964196569381,lr,270
F331,-0.01980290767235229,"Major depressive disorder, recurrent, moderate",0.980391881984183,lr,270
83100,-0.019827749655587555,"Closed dislocation of shoulder, unspecified",0.980367527407996,lr,270
5601,-0.01992527275628762,Paralytic ileus,0.9802719235887638,lr,270
2971,-0.01992781094890845,Delusional disorder,0.9802694354729586,lr,270
1739,-0.019937884323962287,"Other and unspecified malignant neoplasm of skin, site unspecified",0.9802595609010165,lr,270
6923,-0.01993821240454221,Contact dermatitis and other eczema due to drugs and medicines in contact with skin,0.980259239296944,lr,270
0940,-0.019964402750147398,Tabes dorsalis,0.9802335663048779,lr,270
57142,-0.019968884604432916,Autoimmune hepatitis,0.9802291730507129,lr,270
2411,-0.0199783142147431,Nontoxic multinodular goiter,0.980219929915176,lr,270
42840,-0.01998111400297575,"Combined systolic and diastolic heart failure, unspecified",0.9802171855107927,lr,270
7829,-0.020025813326672026,Other symptoms involving skin and integumentary tissues,0.9801733714447618,lr,270
7200,-0.020044175228209782,Ankylosing spondylitis,0.9801553737630617,lr,270
E079,-0.020047228319941296,"Disorder of thyroid, unspecified",0.9801523812633627,lr,270
E11319,-0.0200544143445609,Type 2 diabetes mellitus with unspecified diabetic retinopathy without macular edema,0.9801453378895268,lr,270
E210,-0.020072075207415045,Primary hyperparathyroidism,0.9801280278299931,lr,270
37214,-0.020087864957881632,Other chronic allergic conjunctivitis,0.9801125519751885,lr,270
53012,-0.020095877724406422,Acute esophagitis,0.9801046985936053,lr,270
R251,-0.02010208756010711,"Tremor, unspecified",0.9800986123233549,lr,270
45381,-0.02010370748084099,Acute venous embolism and thrombosis of superficial veins of upper extremity,0.9800970246425775,lr,270
72479,-0.020109535128844214,Other disorders of coccyx,0.9800913129987516,lr,270
V769,-0.020118166903801825,Special screening for unspecified malignant neoplasms,0.9800828531076119,lr,270
1726,-0.02015138272310247,"Malignant melanoma of skin of upper limb, including shoulder",0.9800502993933156,lr,270
71996,-0.020155328155167646,"Unspecified disorder of joint, lower leg",0.9800464326790668,lr,270
71659,-0.020165142751601244,"Unspecified polyarthropathy or polyarthritis, multiple sites",0.9800368139660458,lr,270
3484,-0.020187492530105718,Compression of brain,0.980014910605096,lr,270
179,-0.020196941569521933,"Malignant neoplasm of uterus, part unspecified",0.9800056504493271,lr,270
K4090,-0.020198206082699916,"Unilateral inguinal hernia, without obstruction or gangrene, not specified as recurrent",0.9800044112200511,lr,270
G40209,-0.020200275277960717,"Localization-related (focal) (partial) symptomatic epilepsy and epileptic syndromes with complex partial seizures, not intractable, without status epilepticus",0.9800023834016658,lr,270
58181,-0.020208780099759165,Nephrotic syndrome in diseases classified elsewhere,0.9799940486914755,lr,270
V1272,-0.020235506386707167,Personal history of colonic polyps,0.9799678574393219,lr,270
2858,-0.020255002654980588,Other specified anemias,0.9799487519093179,lr,270
71956,-0.020261302231253376,"Stiffness of joint, not elsewhere classified, lower leg",0.9799425786668562,lr,270
27503,-0.020300288250159445,Other hemochromatosis,0.9799043753516599,lr,270
5710,-0.02034821570536347,Alcoholic fatty liver,0.9798574121540282,lr,270
8248,-0.020379823084338215,"Unspecified fracture of ankle, closed",0.9798264419189077,lr,270
5855,-0.020386176658360605,"Chronic kidney disease, Stage V",0.9798202165388565,lr,270
6924,-0.020398563526474664,Contact dermatitis and other eczema due to other chemical products,0.9798080797102275,lr,270
6108,-0.020398751782408592,Other specified benign mammary dysplasias,0.9798078952555598,lr,270
7517,-0.020404470269163606,Anomalies of pancreas,0.9798022922531087,lr,270
71902,-0.020413964526348444,"Effusion of joint, upper arm",0.9797929898023158,lr,270
71901,-0.02042178026261511,"Effusion of joint, shoulder region",0.9797853320286372,lr,270
Z86711,-0.020425567524868616,Personal history of pulmonary embolism,0.9797816213316594,lr,270
30490,-0.020460600747589035,"Unspecified drug dependence, unspecified",0.9797472970251508,lr,270
4564,-0.020469884377122428,Scrotal varices,0.979738201456429,lr,270
42821,-0.020476336999490224,Acute systolic heart failure,0.979731879596192,lr,270
87343,-0.02049004194776197,"Open wound of lip, without mention of complication",0.9797184525134709,lr,270
7960,-0.020494703897161664,Nonspecific abnormal toxicological findings,0.9797138851262658,lr,270
71942,-0.020497112652125376,"Pain in joint, upper arm",0.9797115252384242,lr,270
V8522,-0.020502656584463284,"Body Mass Index 26.0-26.9, adult",0.9797060937990734,lr,270
D259,-0.020509288746007198,"Leiomyoma of uterus, unspecified",0.9796995962515401,lr,270
E887,-0.02054494902575067,"Fracture, cause unspecified",0.979664660512786,lr,270
42090,-0.02059666852003847,"Acute pericarditis, unspecified",0.9796139940622056,lr,270
E109,-0.02062276220595941,Type 1 diabetes mellitus without complications,0.9795884326558179,lr,270
V531,-0.020626415374411528,Fitting and adjustment of spectacles and contact lenses,0.9795848540607962,lr,270
Z1212,-0.020633582897866376,Encounter for screening for malignant neoplasm of rectum,0.979577832888541,lr,270
Z01810,-0.020650977570836948,Encounter for preprocedural cardiovascular examination,0.9795607936006855,lr,270
L409,-0.020683088454990988,"Psoriasis, unspecified",0.9795293395425319,lr,270
53561,-0.020686137121333256,"Duodenitis, with hemorrhage",0.9795263532889552,lr,270
34610,-0.02070901644320523,"Migraine without aura, without mention of intractable migraine without mention of status migrainosus",0.9795039426466073,lr,270
73392,-0.02072767410926461,Chondromalacia,0.9794856675596274,lr,270
R252,-0.020753960232431454,Cramp and spasm,0.9794599210171197,lr,270
65421,-0.020754665750868328,"Previous cesarean delivery, delivered, with or without mention of antepartum condition",0.979459229990331,lr,270
R011,-0.020756950443807404,"Cardiac murmur, unspecified",0.9794569922293004,lr,270
5829,-0.020759442800401505,Chronic glomerulonephritis with unspecified pathological lesion in kidney,0.9794545510762492,lr,270
5769,-0.020766322486233828,Unspecified disorder of biliary tract,0.9794478127598296,lr,270
52800,-0.020784561364259106,"Stomatitis and mucositis, unspecified",0.9794299488935495,lr,270
V6289,-0.020787246531226246,"Other psychological or physical stress, not elsewhere classified",0.9794273189641349,lr,270
E8810,-0.02080832802594346,Accidental fall from ladder,0.979406671389926,lr,270
6102,-0.020835554256088098,Fibroadenosis of breast,0.9793800062014835,lr,270
1552,-0.02085396385462924,"Malignant neoplasm of liver, not specified as primary or secondary",0.9793619763747115,lr,270
29383,-0.02092582487355006,Mood disorder in conditions classified elsewhere,0.9792916009538519,lr,270
Z21,-0.0209565876771464,Asymptomatic human immunodeficiency virus [HIV] infection status,0.9792614756620398,lr,270
78191,-0.020982107311100735,Loss of height,0.9792364855865054,lr,270
6160,-0.020999859798838113,Cervicitis and endocervicitis,0.9792191018571058,lr,270
V169,-0.021024984560932977,Family history of unspecified malignant neoplasm,0.9791944995191981,lr,270
3670,-0.021051795999387626,Hypermetropia,0.9791682462580845,lr,270
29650,-0.021068957782377516,"Bipolar I disorder, most recent episode (or current) depressed, unspecified",0.9791514421293265,lr,270
570,-0.02112440545824262,Acute and subacute necrosis of liver,0.9790971519626861,lr,270
71981,-0.02115305215659116,"Other specified disorders of joint, shoulder region",0.979069104463656,lr,270
X58XXXA,-0.0211722026858601,"Exposure to other specified factors, initial encounter",0.9790503549516467,lr,270
4379,-0.021239806205982446,Unspecified cerebrovascular disease,0.9789841699384702,lr,270
84509,-0.021258677893865093,Other sprains and strains of ankle,0.9789656950290999,lr,270
M859,-0.021270642354355333,"Disorder of bone density and structure, unspecified",0.9789539823027888,lr,270
5128,-0.02130129884262802,Other pneumothorax and air leak,0.9789239714715265,lr,270
78039,-0.021310256887210836,Other convulsions,0.9789152022662244,lr,270
V7799,-0.021321943960596494,"Screening for other and unspecified endocrine, nutritional, metabolic, and immunity disorders",0.9789037616792708,lr,270
V770,-0.02132391160003616,Screening for thyroid disorders,0.9789018355515167,lr,270
1809,-0.021324443818249474,"Malignant neoplasm of cervix uteri, unspecified site",0.9789013145622694,lr,270
99604,-0.021362789390495004,Mechanical complication of automatic implantable cardiac defibrillator,0.9788637787508613,lr,270
2397,-0.021384687485733064,Neoplasm of unspecified nature of endocrine glands and other parts of nervous system,0.978842343733303,lr,270
R1084,-0.02138503542065843,Generalized abdominal pain,0.9788420031599244,lr,270
44021,-0.02144017296365795,Atherosclerosis of native arteries of the extremities with intermittent claudication,0.9787880337047707,lr,270
5933,-0.021452579016146167,Stricture or kinking of ureter,0.9787758908843721,lr,270
2768,-0.02147961015799955,Hypopotassemia,0.978749433812007,lr,270
E8780,-0.021484533168581718,"Surgical operation with transplant of whole organ causing abnormal patient reaction, or later complication, without mention of misadventure at time of operation",0.9787446154300475,lr,270
73028,-0.021494509084927095,"Unspecified osteomyelitis, other specified sites",0.9787348516043421,lr,270
72633,-0.02149970738679704,Olecranon bursitis,0.9787297638583567,lr,270
79508,-0.021504935451273875,Unsatisfactory cervical cytology smear,0.9787246470094215,lr,270
7289,-0.02151070275544847,"Unspecified disorder of muscle, ligament, and fascia",0.9787190024229561,lr,270
71948,-0.021520408769552163,"Pain in joint, other specified sites",0.9787095030086158,lr,270
04109,-0.021520674083822897,"Streptococcus infection in conditions classified elsewhere and of unspecified site, other streptococcus",0.9787092433430522,lr,270
66331,-0.021560654968940603,"Other and unspecified cord entanglement, without mention of compression, complicating labor and delivery, delivered, with or without mention of antepartum condition",0.9786701144634393,lr,270
4592,-0.0215621310987134,Compression of vein,0.9786686698204118,lr,270
R1030,-0.021609578860616045,"Lower abdominal pain, unspecified",0.9786222352840007,lr,270
04111,-0.021614681745052038,Methicillin susceptible Staphylococcus aureus in conditions classified elsewhere and of unspecified site,0.978617241500569,lr,270
M4712,-0.021672784193105265,"Other spondylosis with myelopathy, cervical region",0.978560383094953,lr,270
05410,-0.021729828107243138,"Genital herpes, unspecified",0.9785045637725723,lr,270
2728,-0.021746150536684394,Other disorders of lipoid metabolism,0.978488592331219,lr,270
8831,-0.021752612695545983,"Open wound of finger(s), complicated",0.9784822692029216,lr,270
V674,-0.021768567183348884,"Follow-up examination, following treatment of healed fracture",0.9784666581440258,lr,270
4210,-0.02178072437155532,Acute and subacute bacterial endocarditis,0.9784547628130161,lr,270
E871,-0.021793999808105275,Foreign object left in body during procedure,0.9784417734851151,lr,270
6208,-0.021819811953918723,"Other noninflammatory disorders of ovary, fallopian tube, and broad ligament",0.9784165181293367,lr,270
4580,-0.02182316236956603,Orthostatic hypotension,0.9784132400328164,lr,270
N400,-0.02182559339369322,Benign prostatic hyperplasia without lower urinary tract symptoms,0.9784108614895146,lr,270
85220,-0.02185216599053267,"Subdural hemorrhage following injury without mention of open intracranial wound, unspecified state of consciousness",0.9783848629175752,lr,270
73342,-0.021855813702307433,Aseptic necrosis of head and neck of femur,0.9783812940580996,lr,270
G459,-0.021863543648756242,"Transient cerebral ischemic attack, unspecified",0.9783737312523201,lr,270
R29898,-0.021900219641778376,Other symptoms and signs involving the musculoskeletal system,0.9783378490821908,lr,270
K7689,-0.021900778724541454,Other specified diseases of liver,0.9783373021105157,lr,270
G2581,-0.021908389515506683,Restless legs syndrome,0.9783298562181505,lr,270
36101,-0.021910474739325655,"Recent retinal detachment, partial, with single defect",0.9783278161835585,lr,270
V4281,-0.021910598470064012,Bone marrow replaced by transplant,0.9783276951343429,lr,270
2764,-0.02193418602219567,Mixed acid-base balance disorder,0.9783046190509873,lr,270
220,-0.021953752374516678,Benign neoplasm of ovary,0.9782854773854006,lr,270
2740,-0.021960715738884102,Gouty arthropathy,0.9782786652508839,lr,270
0310,-0.02199610152643135,Pulmonary diseases due to other mycobacteria,0.9782440487023439,lr,270
6216,-0.021997565837800517,Malposition of uterus,0.9782426162495104,lr,270
05319,-0.02203859370220235,Herpes zoster with other nervous system complications,0.9782024818674184,lr,270
44101,-0.022071378531957415,"Dissection of aorta, thoracic",0.9781704121912866,lr,270
V168,-0.022090516018493968,Family history of other specified malignant neoplasm,0.9781516926473159,lr,270
L603,-0.022116311988925854,Nail dystrophy,0.9781264606006185,lr,270
K5790,-0.02214032710668582,"Diverticulosis of intestine, part unspecified, without perforation or abscess without bleeding",0.9781029710605362,lr,270
3330,-0.02214664046925077,Other degenerative diseases of the basal ganglia,0.9780967959613469,lr,270
8405,-0.022149462458183593,Subscapularis (muscle) sprain,0.9780940357869081,lr,270
L299,-0.02215194831156458,"Pruritus, unspecified",0.9780916043915643,lr,270
V8543,-0.022259690894298616,"Body Mass Index 50.0-59.9, adult",0.9779862279528235,lr,270
M25572,-0.022286928387022578,Pain in left ankle and joints of left foot,0.9779595904228269,lr,270
5935,-0.022298990361798204,Hydroureter,0.9779477943700576,lr,270
M79604,-0.02231923419689516,Pain in right leg,0.9779279971565614,lr,270
85221,-0.02232467435456771,"Subdural hemorrhage following injury without mention of open intracranial wound, with no loss of consciousness",0.9779226770885355,lr,270
V5873,-0.02232483779459904,"Aftercare following surgery of the circulatory system, NEC",0.9779225172568355,lr,270
V1229,-0.02235915841230129,"Personal history of other endocrine, metabolic, and immunity disorders",0.9778889549279216,lr,270
5259,-0.022361509608441448,Unspecified disorder of the teeth and supporting structures,0.9778866557218883,lr,270
5839,-0.022367489592547963,"Nephritis and nephropathy, not specified as acute or chronic, with unspecified pathological lesion in kidney",0.9778808079927137,lr,270
62210,-0.022370053130015832,"Dysplasia of cervix, unspecified",0.9778783011618365,lr,270
4262,-0.02237603142982846,Left bundle branch hemiblock,0.9778724551296466,lr,270
7895,-0.02243347972480979,Ascites,0.9778162796379987,lr,270
6113,-0.02244136136276096,Fat necrosis of breast,0.9778085728744709,lr,270
36552,-0.022475023434181566,Pseudoexfoliation glaucoma,0.9777756583664434,lr,270
R921,-0.022479298725076566,Mammographic calcification found on diagnostic imaging of breast,0.9777714781000097,lr,270
W19XXXA,-0.022491740226576604,"Unspecified fall, initial encounter",0.9777593132303731,lr,270
2381,-0.02251025819168271,Neoplasm of uncertain behavior of connective and other soft tissue,0.9777412072851717,lr,270
D2272,-0.022552975351058244,"Melanocytic nevi of left lower limb, including hip",0.9776994418502488,lr,270
M722,-0.022598587159316542,Plantar fascial fibromatosis,0.9776548482277785,lr,270
R799,-0.0226101693858606,"Abnormal finding of blood chemistry, unspecified",0.9776435248734193,lr,270
2692,-0.022620288457333063,Unspecified vitamin deficiency,0.9776336320787696,lr,270
M25519,-0.022622939360196104,Pain in unspecified shoulder,0.9776310404704104,lr,270
78096,-0.022650272664608808,Generalized pain,0.9776043189487733,lr,270
I110,-0.022678649368957658,Hypertensive heart disease with heart failure,0.9775765781536423,lr,270
V659,-0.02268939238362513,Unspecified reason for consultation,0.9775660760905367,lr,270
72992,-0.022716380216971616,Nontraumatic hematoma of soft tissue,0.9775396940561886,lr,270
59689,-0.022716478343038374,Other specified disorders of bladder,0.977539598134068,lr,270
3369,-0.022740220934388426,Unspecified disease of spinal cord,0.9775163890863835,lr,270
34680,-0.02276257400980237,"Other forms of migraine, without mention of intractable migraine without mention of status migrainosus",0.9774945388330311,lr,270
5716,-0.02283630549276065,Biliary cirrhosis,0.9774224693680261,lr,270
N289,-0.022848042658239167,"Disorder of kidney and ureter, unspecified",0.9774109972660858,lr,270
M353,-0.022848300342922616,Polymyalgia rheumatica,0.9774107454022749,lr,270
I872,-0.022889443682841876,Venous insufficiency (chronic) (peripheral),0.9773705322869927,lr,270
1972,-0.02289140756137119,Secondary malignant neoplasm of pleura,0.9773686128518739,lr,270
30393,-0.022926918496077125,"Other and unspecified alcohol dependence, in remission",0.9773339061951158,lr,270
3383,-0.02293355658125108,Neoplasm related pain (acute) (chronic),0.9773274185909357,lr,270
72664,-0.022963972027305938,Patellar tendinitis,0.9772976931936156,lr,270
8920,-0.02300810351092725,"Open wound of foot except toe(s) alone, without mention of complication",0.9772545645481479,lr,270
04186,-0.02301284222361411,Helicobacter pylori [H. pylori],0.9772499336305168,lr,270
C439,-0.023021095894434365,"Malignant melanoma of skin, unspecified",0.977241867764542,lr,270
4730,-0.023068705225482936,Chronic maxillary sinusitis,0.9771953430404594,lr,270
6953,-0.023084009891280014,Rosacea,0.9771803875067607,lr,270
