feature,weight,feature_desc,odds_ratio,model,cutoff
33700,0.00022747807583019738,"Idiopathic peripheral autonomic neuropathy, unspecified",1.0002275039509296,lr,270
R2689,9.917816740768345e-05,Other abnormalities of gait and mobility,1.0000991830857247,lr,270
M48061,0.0,"Spinal stenosis, lumbar region without neurogenic claudication",1.0,lr,270
1570,0.0,Malignant neoplasm of head of pancreas,1.0,lr,270
1579,0.0,"Malignant neoplasm of pancreas, part unspecified",1.0,lr,270
I2720,0.0,"Pulmonary hypertension, unspecified",1.0,lr,270
V1043,-3.520575867389516e-05,Personal history of malignant neoplasm of ovary,0.9999647948610415,lr,270
78057,-4.674471734027135e-05,Unspecified sleep apnea,0.999953256375177,lr,270
9054,-0.00016790817031224175,Late effect of fracture of lower extremities,0.9998321059254757,lr,270
2399,-0.00021579403316918032,"Neoplasm of unspecified nature, site unspecified",0.9997842292486885,lr,270
C9202,-0.0002726060658870445,"Acute myeloblastic leukemia, in relapse",0.9997274310877704,lr,270
V5409,-0.00027919585270220744,Other aftercare involving internal fixation device,0.9997208431188329,lr,270
F0390,-0.00028578322111189893,Unspecified dementia without behavioral disturbance,0.9997142576110231,lr,270
C9310,-0.0002873199287188042,Chronic myelomonocytic leukemia not having achieved remission,0.999712721343699,lr,270
E9300,-0.0003182032425343577,Penicillins causing adverse effects in therapeutic use,0.999681847378748,lr,270
24291,-0.00032049710225016476,"Thyrotoxicosis without mention of goiter or other cause, with mention of thyrotoxic crisis or storm",0.9996795542514597,lr,270
29600,-0.0003712120777165076,"Bipolar I disorder, single manic episode, unspecified",0.9996288568129622,lr,270
C678,-0.00041705982518739954,Malignant neoplasm of overlapping sites of bladder,0.9995830271321723,lr,270
2518,-0.0004596527697035355,Other specified disorders of pancreatic internal secretion,0.9995404528544467,lr,270
99831,-0.0004869868622866479,Disruption of internal operation (surgical) wound,0.9995131316965691,lr,270
C714,-0.0005494803960709934,Malignant neoplasm of occipital lobe,0.999450670540635,lr,270
C01,-0.0005509335221799405,Malignant neoplasm of base of tongue,0.9994492182138263,lr,270
5780,-0.0006089670715197932,Hematemesis,0.9993912183112947,lr,270
7104,-0.0006545038735742174,Polymyositis,0.9993457102673649,lr,270
25061,-0.0006931326395075108,"Diabetes with neurological manifestations, type I [juvenile type], not stated as uncontrolled",0.9993071075214295,lr,270
C9112,-0.0006964954705384415,Chronic lymphocytic leukemia of B-cell type in relapse,0.9993037470261292,lr,270
T8649,-0.0007521816938701724,Other complications of liver transplant,0.9992481011238655,lr,270
3553,-0.0007854452735371324,Lesion of lateral popliteal nerve,0.9992148631078576,lr,270
F429,-0.0008113696562979513,"Obsessive-compulsive disorder, unspecified",0.9991889594150561,lr,270
1983,-0.0008251612620279157,Secondary malignant neoplasm of brain and spinal cord,0.9991751790899047,lr,270
78933,-0.0008317732987773049,"Abdominal or pelvic swelling, mass, or lump, right lower quadrant",0.9991685725287429,lr,270
72679,-0.0008384020315494328,Other enthesopathy of ankle and tarsus,0.9991619493292331,lr,270
E1159,-0.0008598028138147153,Type 2 diabetes mellitus with other circulatory complications,0.9991405667107109,lr,270
0709,-0.0008684039329616413,Unspecified viral hepatitis without mention of hepatic coma,0.9991319730206099,lr,270
Z596,-0.0008694935408907744,Low income,0.9991308843590829,lr,270
C9101,-0.0009097929020211454,"Acute lymphoblastic leukemia, in remission",0.9990906208340602,lr,270
33828,-0.0009139919188864261,Other chronic postoperative pain,0.9990864256445012,lr,270
D619,-0.0009379767296540161,"Aplastic anemia, unspecified",0.9990624630330122,lr,270
C3402,-0.0010084922969547357,Malignant neoplasm of left main bronchus,0.9989920160604959,lr,270
C519,-0.0010462355097399644,"Malignant neoplasm of vulva, unspecified",0.9989543116038111,lr,270
D89811,-0.0010782357237886016,Chronic graft-versus-host disease,0.998922345363481,lr,270
C4921,-0.0010891543347433068,"Malignant neoplasm of connective and soft tissue of right lower limb, including hip",0.9989114385785616,lr,270
07051,-0.0010928989036428245,Acute hepatitis C without mention of hepatic coma,0.9989076980928585,lr,270
C19,-0.0010961592064343338,Malignant neoplasm of rectosigmoid junction,0.9989044413566109,lr,270
J9621,-0.0011225334662536104,Acute and chronic respiratory failure with hypoxia,0.9988780963387567,lr,270
C5700,-0.0011602565683401934,Malignant neoplasm of unspecified fallopian tube,0.9988404162690655,lr,270
29645,-0.001173184446046472,"Bipolar I disorder, most recent episode (or current) manic, in partial or unspecified remission",0.9988275034657836,lr,270
49392,-0.0011768466996525775,"Asthma, unspecified type, with (acute) exacerbation",0.9988238455128554,lr,270
S52572D,-0.0011841393580172513,"Other intraarticular fracture of lower end of left radius, subsequent encounter for closed fracture with routine healing",0.9988165614583436,lr,270
C482,-0.0011895333065002874,"Malignant neoplasm of peritoneum, unspecified",0.9988111739077973,lr,270
Z96611,-0.0012258508970425855,Presence of right artificial shoulder joint,0.9987749001512459,lr,270
F250,-0.0012651909713247405,"Schizoaffective disorder, bipolar type",0.9987356090453453,lr,270
1414,-0.0012874892457267145,"Malignant neoplasm of anterior two-thirds of tongue, part unspecified",0.9987133392129702,lr,270
78491,-0.0012907975650267398,Postnasal drip,0.9987100351558204,lr,270
M86171,-0.0012942078366701428,"Other acute osteomyelitis, right ankle and foot",0.9987066292891149,lr,270
C50311,-0.0012966562542299793,Malignant neoplasm of lower-inner quadrant of right female breast,0.9987041840412602,lr,270
3541,-0.0012997997678253932,Other lesion of median nerve,0.9987010446060143,lr,270
C211,-0.0013082348305026815,Malignant neoplasm of anal canal,0.9986926205356359,lr,270
7994,-0.00132034983161902,Cachexia,0.9986805214467136,lr,270
60000,-0.0013322753777544945,Hypertrophy (benign) of prostate without urinary obstruction and other lower urinary tract symptom (LUTS),0.9986686117070958,lr,270
4660,-0.0013486681022292606,Acute bronchitis,0.9986522409418835,lr,270
2554,-0.00135135238213191,Corticoadrenal insufficiency,0.9986495602833413,lr,270
M86172,-0.001354316274606057,"Other acute osteomyelitis, left ankle and foot",0.9986466003978116,lr,270
M1710,-0.0013743489855421941,"Unilateral primary osteoarthritis, unspecified knee",0.9986265949995203,lr,270
C50312,-0.0013930181643182933,Malignant neoplasm of lower-inner quadrant of left female breast,0.9986079516351164,lr,270
E9342,-0.001436196694202665,Anticoagulants causing adverse effects in therapeutic use,0.9985648341427157,lr,270
56401,-0.0014364004624345796,Slow transit constipation,0.9985646306669457,lr,270
C713,-0.0014377534498651804,Malignant neoplasm of parietal lobe,0.9985632796224657,lr,270
F17219,-0.0014485879337892088,"Nicotine dependence, cigarettes, with unspecified nicotine-induced disorders",0.998552460763274,lr,270
G5603,-0.0014708095523883512,"Carpal tunnel syndrome, bilateral upper limbs",0.9985302715578807,lr,270
C50811,-0.0014832872826654245,Malignant neoplasm of overlapping sites of right female breast,0.9985178122442108,lr,270
Z433,-0.0014945489561322446,Encounter for attention to colostomy,0.9985065673259769,lr,270
V4571,-0.001508644225168028,Acquired absence of breast and nipple,0.9984924932064659,lr,270
D89813,-0.0015089721020299597,"Graft-versus-host disease, unspecified",0.9984921658239343,lr,270
Y92129,-0.0015770723028036325,Unspecified place in nursing home as the place of occurrence of the external cause,0.9984241706222404,lr,270
C55,-0.0015971380088347714,"Malignant neoplasm of uterus, part unspecified",0.9984041367373361,lr,270
72632,-0.0015984546281638745,Lateral epicondylitis,0.9984028222200168,lr,270
C210,-0.0016035938956664123,"Malignant neoplasm of anus, unspecified",0.998397691174023,lr,270
C8338,-0.0016267139931003807,"Diffuse large B-cell lymphoma, lymph nodes of multiple sites",0.9983746083889643,lr,270
D7581,-0.0016304400618992526,Myelofibrosis,0.9983708883834169,lr,270
E1152,-0.0016323358273355694,Type 2 diabetes mellitus with diabetic peripheral angiopathy with gangrene,0.9983689957081882,lr,270
I70245,-0.0016423395076469826,Atherosclerosis of native arteries of left leg with ulceration of other part of foot,0.9983590083938773,lr,270
R570,-0.0016517718473409466,Cardiogenic shock,0.9983495915769849,lr,270
Z96612,-0.0016629825219173632,Presence of left artificial shoulder joint,0.9983383994673359,lr,270
C342,-0.0016661465808565554,"Malignant neoplasm of middle lobe, bronchus or lung",0.998335240670796,lr,270
20158,-0.001684071517440281,"Hodgkin's disease, nodular sclerosis, lymph nodes of multiple sites",0.9983173457353011,lr,270
23877,-0.0016997056099499288,Post-transplant lymphoproliferative disorder (PTLD),0.99830173807157,lr,270
C180,-0.0017067346400671981,Malignant neoplasm of cecum,0.9982947210032486,lr,270
S42202D,-0.0017121250420772216,"Unspecified fracture of upper end of left humerus, subsequent encounter for fracture with routine healing",0.9982893398078813,lr,270
Y842,-0.0017452318244613836,"Radiological procedure and radiotherapy as the cause of abnormal reaction of the patient, or of later complication, without mention of misadventure at the time of the procedure",0.9982562902070378,lr,270
R498,-0.001746290261494681,Other voice and resonance disorders,0.9982552336161707,lr,270
1509,-0.0017731363562182776,"Malignant neoplasm of esophagus, unspecified site",0.9982284347213352,lr,270
C50511,-0.001781873662796813,Malignant neoplasm of lower-outer quadrant of right female breast,0.9982197129315681,lr,270
S72001D,-0.0017838872248357371,"Fracture of unspecified part of neck of right femur, subsequent encounter for closed fracture with routine healing",0.9982177029562712,lr,270
E8881,-0.0018025422796122893,Fall resulting in striking against other object,0.998199081324038,lr,270
734,-0.0018192882205577314,Flat foot,0.9981823656811304,lr,270
K5720,-0.0018198213285279365,Diverticulitis of large intestine with perforation and abscess without bleeding,0.9981818335422973,lr,270
M009,-0.0018304614461932718,"Pyogenic arthritis, unspecified",0.99817121282664,lr,270
C8339,-0.0018402341939010025,"Diffuse large B-cell lymphoma, extranodal and solid organ sites",0.9981614579988737,lr,270
K810,-0.0018451789692886366,Acute cholecystitis,0.9981565223268662,lr,270
J9691,-0.0018464300142291075,"Respiratory failure, unspecified with hypoxia",0.9981552735889803,lr,270
F4312,-0.0018754112351692378,"Post-traumatic stress disorder, chronic",0.9981263462496407,lr,270
V549,-0.0018801124754263712,Unspecified orthopedic aftercare,0.99812165382891,lr,270
C782,-0.001886847019821864,Secondary malignant neoplasm of pleura,0.9981149319569547,lr,270
I132,-0.0018868711988683524,"Hypertensive heart and chronic kidney disease with heart failure and with stage 5 chronic kidney disease, or end stage renal disease",0.9981149078234877,lr,270
K581,-0.0018885474384797481,Irritable bowel syndrome with constipation,0.9981132347451447,lr,270
29626,-0.001899422505284063,"Major depressive affective disorder, single episode, in full remission",0.9981023802560602,lr,270
C9002,-0.001905064971347162,Multiple myeloma in relapse,0.9980967485131407,lr,270
41519,-0.0019066382734284127,Other pulmonary embolism and infarction,0.9980951782066843,lr,270
Z931,-0.0019180864791071366,Gastrostomy status,0.9980837518732028,lr,270
J3800,-0.0019371210977952812,"Paralysis of vocal cords and larynx, unspecified",0.9980647539103771,lr,270
L97522,-0.0019496316822161172,Non-pressure chronic ulcer of other part of left foot with fat layer exposed,0.9980522676151214,lr,270
E1022,-0.001956844289843921,Type 1 diabetes mellitus with diabetic chronic kidney disease,0.9980450690816832,lr,270
42511,-0.001987730647273279,Hypertrophic obstructive cardiomyopathy,0.9980142435809951,lr,270
K9189,-0.002014428448486492,Other postprocedural complications and disorders of digestive system,0.9979875991507875,lr,270
M315,-0.002039317672914171,Giant cell arteritis with polymyalgia rheumatica,0.997962760322567,lr,270
E032,-0.0020400776018140118,Hypothyroidism due to medicaments and other exogenous substances,0.9979620019421127,lr,270
F29,-0.0020431679644567404,Unspecified psychosis not due to a substance or known physiological condition,0.9979589178823884,lr,270
M65841,-0.0020606378935704123,"Other synovitis and tenosynovitis, right hand",0.9979414837631215,lr,270
28260,-0.0020638688552902956,"Sickle-cell disease, unspecified",0.9979382594575976,lr,270
J9809,-0.0020672832445960024,"Other diseases of bronchus, not elsewhere classified",0.9979348521136938,lr,270
J3801,-0.002075102556844606,"Paralysis of vocal cords and larynx, unilateral",0.997927048979989,lr,270
7336,-0.0020781952341524792,Tietze's disease,0.9979239627184221,lr,270
S72002D,-0.0020799935907970003,"Fracture of unspecified part of neck of left femur, subsequent encounter for closed fracture with routine healing",0.9979221680968466,lr,270
D684,-0.0020925001378321903,Acquired coagulation factor deficiency,0.9979096876143579,lr,270
Y830,-0.002093433969861428,"Surgical operation with transplant of whole organ as the cause of abnormal reaction of the patient, or of later complication, without mention of misadventure at the time of the procedure",0.9979087557347645,lr,270
J910,-0.002109543760405355,Malignant pleural effusion,0.9978926797632183,lr,270
M7522,-0.002117273698137372,"Bicipital tendinitis, left shoulder",0.9978849661447533,lr,270
V850,-0.002135722964293951,"Body Mass Index less than 19, adult",0.997866556069246,lr,270
M21372,-0.0021545268136637817,"Foot drop, left foot",0.9978477925132486,lr,270
I70235,-0.0021619150935638523,Atherosclerosis of native arteries of right leg with ulceration of other part of foot,0.9978404201616944,lr,270
H401133,-0.0021763148204113126,"Primary open-angle glaucoma, bilateral, severe stage",0.9978260516356584,lr,270
J3081,-0.0021797380415926387,Allergic rhinitis due to animal (cat) (dog) hair and dander,0.9978226358622296,lr,270
C9200,-0.0021838194289787566,"Acute myeloblastic leukemia, not having achieved remission",0.9978185633698207,lr,270
G8191,-0.0021874319540346365,"Hemiplegia, unspecified affecting right dominant side",0.9978149587317703,lr,270
C50111,-0.002194114606413577,Malignant neoplasm of central portion of right female breast,0.9978082907035426,lr,270
G6181,-0.002195292410964147,Chronic inflammatory demyelinating polyneuritis,0.9978071154810894,lr,270
75453,-0.002212157902639439,Metatarsus varus,0.9977902871153994,lr,270
Z79891,-0.0022252770896803485,Long term (current) use of opiate analgesic,0.9977771970038611,lr,270
4263,-0.0022315358334991865,Other left bundle branch block,0.9977709521915391,lr,270
E9179,-0.0022348105179578284,Other accident caused by striking against or being struck accidentally by objects or persons,0.9977676848118585,lr,270
M459,-0.0022384968297919144,Ankylosing spondylitis of unspecified sites in spine,0.9977640067358136,lr,270
49122,-0.002250051620247714,Obstructive chronic bronchitis with acute bronchitis,0.9977524778483985,lr,270
C549,-0.002266924783223485,"Malignant neoplasm of corpus uteri, unspecified",0.9977356427502614,lr,270
Z792,-0.0022763934066719585,Long term (current) use of antibiotics,0.9977261956118848,lr,270
M75100,-0.0022814788524099846,"Unspecified rotator cuff tear or rupture of unspecified shoulder, not specified as traumatic",0.997721121742357,lr,270
C494,-0.0022836869084218317,Malignant neoplasm of connective and soft tissue of abdomen,0.9977189187206682,lr,270
C884,-0.0022887867407542636,Extranodal marginal zone B-cell lymphoma of mucosa-associated lymphoid tissue [MALT-lymphoma],0.9977138305344423,lr,270
F22,-0.0022999048176293915,Delusional disorders,0.9977027379370393,lr,270
M7660,-0.00230783601516213,"Achilles tendinitis, unspecified leg",0.9976948249909254,lr,270
I462,-0.002309909680238947,Cardiac arrest due to underlying cardiac condition,0.9976927561081547,lr,270
F3181,-0.002328883725524826,Bipolar II disorder,0.9976738260202096,lr,270
Z933,-0.002337601475705281,Colostomy status,0.9976651285869439,lr,270
D471,-0.0023398741833555287,Chronic myeloproliferative disease,0.9976628611883502,lr,270
J4550,-0.0023496594258712337,"Severe persistent asthma, uncomplicated",0.9976530988630681,lr,270
E440,-0.002358490145457373,Moderate protein-calorie malnutrition,0.9976442889072069,lr,270
M65311,-0.00236266916858132,"Trigger thumb, right thumb",0.9976401197373657,lr,270
3530,-0.002369869253164048,Brachial plexus lesions,0.9976329366699799,lr,270
0311,-0.002383305013912896,Cutaneous diseases due to other mycobacteria,0.9976195328025733,lr,270
1611,-0.0023847301002270314,Malignant neoplasm of supraglottis,0.9976181111096435,lr,270
2326,-0.002397165302155917,"Carcinoma in situ of skin of upper limb, including shoulder",0.9976057056041165,lr,270
72751,-0.002411258655624915,Synovial cyst of popliteal space,0.9975916460933578,lr,270
Z6824,-0.002413615466711705,"Body mass index (BMI) 24.0-24.9, adult",0.9975892949610768,lr,270
C778,-0.0024244502406204804,Secondary and unspecified malignant neoplasm of lymph nodes of multiple regions,0.9975784863651666,lr,270
81344,-0.0024249720341941684,Closed fracture of lower end of radius with ulna,0.9975779658352589,lr,270
30789,-0.002430503492444547,Other pain disorders related to psychological factors,0.9975724477896508,lr,270
C50112,-0.002436999923901723,Malignant neoplasm of central portion of left female breast,0.9975659671496707,lr,270
E662,-0.002448153893132624,Morbid (severe) obesity with alveolar hypoventilation,0.9975548403916212,lr,270
C712,-0.002453317952111056,Malignant neoplasm of temporal lobe,0.9975496889728923,lr,270
K8689,-0.002455642659183945,Other specified diseases of pancreas,0.9975473699647703,lr,270
4466,-0.0024566174829382427,Thrombotic microangiopathy,0.9975463975323721,lr,270
7262,-0.002459361085122597,"Other affections of shoulder region, not elsewhere classified",0.9975436606656513,lr,270
C7A8,-0.0024598583166914527,Other malignant neuroendocrine tumors,0.9975431646555751,lr,270
H43813,-0.002462571370694621,"Vitreous degeneration, bilateral",0.9975404582707702,lr,270
D6861,-0.0024704838764440166,Antiphospholipid syndrome,0.9975325652573857,lr,270
K8590,-0.002473764523158255,"Acute pancreatitis without necrosis or infection, unspecified",0.9975292927108211,lr,270
T847XXA,-0.002486414421998616,"Infection and inflammatory reaction due to other internal orthopedic prosthetic devices, implants and grafts, initial encounter",0.99751667414599,lr,270
E9444,-0.0025010367247064063,Other diuretics causing adverse effects in therapeutic use,0.9975020882618645,lr,270
C169,-0.0025015806939055105,"Malignant neoplasm of stomach, unspecified",0.9975015456516,lr,270
C711,-0.0025038096193563753,Malignant neoplasm of frontal lobe,0.9974993222974955,lr,270
V8530,-0.0025039039586801596,"Body Mass Index 30.0-30.9, adult",0.9974992281940883,lr,270
C8310,-0.0025089352208062066,"Mantle cell lymphoma, unspecified site",0.9974942095266259,lr,270
S065X0A,-0.0025113591969292627,"Traumatic subdural hemorrhage without loss of consciousness, initial encounter",0.9974917916274096,lr,270
30001,-0.0025136900778686276,Panic disorder without agoraphobia,0.997489466595515,lr,270
Z6826,-0.0025355631275207854,"Body mass index (BMI) 26.0-26.9, adult",0.9974676486974975,lr,270
F3289,-0.0025429338480224255,Other specified depressive episodes,0.9974602966693444,lr,270
F333,-0.002550468240007651,"Major depressive disorder, recurrent, severe with psychotic symptoms",0.997452781440791,lr,270
Z932,-0.0025682564819090896,Ileostomy status,0.9974350386672364,lr,270
I7101,-0.002576911700813576,Dissection of thoracic aorta,0.9974264056859938,lr,270
M2022,-0.0025851708213944263,"Hallux rigidus, left foot",0.9974181678550574,lr,270
I248,-0.0026001919521618606,Other forms of acute ischemic heart disease,0.9974031856188537,lr,270
07810,-0.0026192269597574733,"Viral warts, unspecified",0.9973842002223337,lr,270
M359,-0.0026245213656008793,"Systemic involvement of connective tissue, unspecified",0.9973789196795746,lr,270
7892,-0.002651609529444811,Splenomegaly,0.9973519028819031,lr,270
B957,-0.002653500037632951,Other staphylococcus as the cause of diseases classified elsewhere,0.9973500173817466,lr,270
I679,-0.0026605116912655677,"Cerebrovascular disease, unspecified",0.9973430243333906,lr,270
Z801,-0.0026778105195719095,"Family history of malignant neoplasm of trachea, bronchus and lung",0.9973257716168765,lr,270
M5137,-0.0026794240746302496,"Other intervertebral disc degeneration, lumbosacral region",0.9973241623781313,lr,270
5163,-0.0026978741956670844,Idiopathic interstitial pneumonia,0.9973057617963694,lr,270
78931,-0.0027045659608337215,"Abdominal or pelvic swelling, mass, or lump, right upper quadrant",0.9972990880827416,lr,270
N63,-0.002710696429150776,Unspecified lump in breast,0.99729297419102,lr,270
65103,-0.0027169347288980026,"Twin pregnancy, antepartum condition or complication",0.9972867527979167,lr,270
M65332,-0.0027243965547610522,"Trigger finger, left middle finger",0.9972793112455955,lr,270
H353230,-0.0027264775915772075,"Exudative age-related macular degeneration, bilateral, stage unspecified",0.9972772358727924,lr,270
T402X5A,-0.002732845057457264,"Adverse effect of other opioids, initial encounter",0.9972708857642371,lr,270
I6200,-0.0027328873818514344,"Nontraumatic subdural hemorrhage, unspecified",0.9972708435553519,lr,270
C7830,-0.002744646131463863,Secondary malignant neoplasm of unspecified respiratory organ,0.9972591169661519,lr,270
1745,-0.0027481158418707643,Malignant neoplasm of lower-outer quadrant of female breast,0.9972556567718183,lr,270
Z9079,-0.0027505740916913823,Acquired absence of other genital organ(s),0.9972532052712921,lr,270
R7612,-0.0027554649431609916,Nonspecific reaction to cell mediated immunity measurement of gamma interferon antigen response without active tuberculosis,0.9972483278659149,lr,270
N359,-0.0027702232851963223,"Urethral stricture, unspecified",0.9972336102426023,lr,270
Z48290,-0.00278538073684604,Encounter for aftercare following bone marrow transplant,0.9972184948369273,lr,270
M0589,-0.0027896799776940327,Other rheumatoid arthritis with rheumatoid factor of multiple sites,0.997214207563656,lr,270
C182,-0.002805131355512757,Malignant neoplasm of ascending colon,0.9971987993492081,lr,270
R1314,-0.002813957265128338,"Dysphagia, pharyngoesophageal phase",0.9971899982015754,lr,270
A4151,-0.002819928484947782,Sepsis due to Escherichia coli [E. coli],0.997184043778672,lr,270
5811,-0.0028233881470969033,Nephrotic syndrome with lesion of membranous glomerulonephritis,0.9971805938647478,lr,270
S2241XA,-0.00283224136554471,"Multiple fractures of ribs, right side, initial encounter for closed fracture",0.9971717656461975,lr,270
I972,-0.002843076108248816,Postmastectomy lymphedema syndrome,0.9971609616052145,lr,270
99883,-0.002843307474921115,Non-healing surgical wound,0.9971607308954278,lr,270
F259,-0.002859245549759718,"Schizoaffective disorder, unspecified",0.9971448381997224,lr,270
G893,-0.0028595194296264508,Neoplasm related pain (acute) (chronic),0.9971445651018644,lr,270
R828,-0.0028647036637501804,Abnormal findings on cytological and histological examination of urine,0.9971393956843835,lr,270
V8533,-0.002865591264089939,"Body Mass Index 33.0-33.9, adult",0.9971385106235099,lr,270
M1120,-0.0028731613611118556,"Other chondrocalcinosis, unspecified site",0.9971309622168113,lr,270
7835,-0.0028815136480285428,Polydipsia,0.9971226339277016,lr,270
I8291,-0.0028824134475796885,Chronic embolism and thrombosis of unspecified vein,0.9971217367176067,lr,270
Z6822,-0.002892300308214987,"Body mass index (BMI) 22.0-22.9, adult",0.9971118783626935,lr,270
M6249,-0.0028925887053892186,"Contracture of muscle, multiple sites",0.997111590798487,lr,270
28983,-0.00289689748567953,Myelofibrosis,0.9971072944729732,lr,270
1969,-0.002912592157099017,"Secondary and unspecified malignant neoplasm of lymph nodes, site unspecified",0.997091645324421,lr,270
C9111,-0.0029223573752282855,Chronic lymphocytic leukemia of B-cell type in remission,0.9970819085545504,lr,270
C9210,-0.002928825636278158,"Chronic myeloid leukemia, BCR/ABL-positive, not having achieved remission",0.9970754591893359,lr,270
L97511,-0.0029338925233443154,Non-pressure chronic ulcer of other part of right foot limited to breakdown of skin,0.9970704071333868,lr,270
G9341,-0.002957889742248277,Metabolic encephalopathy,0.9970464805036516,lr,270
E1143,-0.0029583281477664853,Type 2 diabetes mellitus with diabetic autonomic (poly)neuropathy,0.9970460433930685,lr,270
39890,-0.002960178408690251,"Rheumatic heart disease, unspecified",0.9970441985994419,lr,270
Z6827,-0.002965389703844868,"Body mass index (BMI) 27.0-27.9, adult",0.9970390027213795,lr,270
7142,-0.0029662734943421702,Other rheumatoid arthritis with visceral or systemic involvement,0.9970381215481727,lr,270
D6851,-0.0029708085774690484,Activated protein C resistance,0.9970335999076639,lr,270
C50812,-0.0029796875077130348,Malignant neoplasm of overlapping sites of left female breast,0.9970247473551801,lr,270
L97521,-0.0029833353237358603,Non-pressure chronic ulcer of other part of left foot limited to breakdown of skin,0.997021110398965,lr,270
K5731,-0.002988556671146197,Diverticulosis of large intestine without perforation or abscess with bleeding,0.9970159046189627,lr,270
B961,-0.0029903086429620223,Klebsiella pneumoniae [K. pneumoniae] as the cause of diseases classified elsewhere,0.9970141578767281,lr,270
4571,-0.002991878445603385,Other lymphedema,0.997012592762498,lr,270
I4901,-0.0029979067416803697,Ventricular fibrillation,0.9970065824935122,lr,270
B379,-0.0030031141875344275,"Candidiasis, unspecified",0.9970013906492359,lr,270
